Username,Judul,Tipe Koleksi,Tanggal Dipinjam,Harus Kembali,Status Pengembalian
,Teori Keadilan : Dasar-dasar Filsafat Politik untuk Mewujudkan Kesejahteraan Siosial dalam Negara,Buku Teks,3/3/2021,3/10/2021,Sudah Kembali
,Implementasi budaya toleransi dalam pendidikan agama,Disertasi,3/3/2021,3/10/2021,Sudah Kembali
,Pendidikan Toleransi Beragama (Kajian atas Pembelajaran Agama Di Binus School Jakarta),Disertasi,3/3/2021,3/10/2021,Sudah Kembali
,Gerakan Moderen Islam di Indonesia 1900-1942,Buku Teks,3/3/2021,3/10/2021,Sudah Kembali
,"Nalar Islam Nusantara: Studi Islam Ala Muhammadiyah, Al-Irsyad, Persis dan NU",Buku Teks,3/3/2021,3/10/2021,Sudah Kembali
,Perangkat-perangkat tarbiyah ikhwanul muslimin,Buku Teks,3/3/2021,3/10/2021,Sudah Kembali
,HTI dan PKS Menuai Kritik: Perilaku Gerakan Islam Politik Indonesia,Buku Teks,3/3/2021,3/10/2021,Sudah Kembali
,Terorisme dan jihad dalam perspektif hukum Islam,Disertasi,3/3/2021,3/10/2021,Sudah Kembali
,Islam dan Pemerintahan ( Studi Pemikiran Muhammad Rasyid Ridha tentang Khilafah dan Syura'),Disertasi,3/3/2021,3/10/2021,Sudah Kembali
,Ikhwanul Muslimin di Mesir : telaah atas gerakan keagamaan pra rtevolusi di Mesir,Disertasi,3/3/2021,3/10/2021,Sudah Kembali
,Nuansa-nuansa psikologi islam,Buku Teks,3/2/2021,3/9/2021,Sudah Kembali
21191200000011,Metode A'isyah dalam kritik hadis,Disertasi,3/2/2021,3/9/2021,Sudah Kembali
,Active Learning : 101 Strategi Pembelajaran Aktif,Buku Teks,3/2/2021,3/9/2021,Sudah Kembali
,"Pertimbangan hakim dalam penyelesaian sengketa akad pembiayaan syariah di Indonesia, Malaysia, dan Inggris",Disertasi,3/1/2021,3/8/2021,Sudah Kembali
,Penyederhanaan Mata Uang Dalam Axioma Ekonomi Islam,Disertasi,3/1/2021,3/8/2021,Sudah Kembali
pascasarjana,research Methods in Educatio,Buku Teks,3/1/2021,3/8/2021,Sudah Kembali
pascasarjana,Pengembangan profesionalisme guru; 70 tahun abdul malik fadjar,Buku Teks,3/1/2021,3/8/2021,Sudah Kembali
,Kloning Terapeutik dan penggunaan Sel Punca Dalam Terapi : Perspektif Hukum Islam,Disertasi,3/1/2021,3/8/2021,Sudah Kembali
,Qur'anic soteriology: doktrin teologis tentang keselamatan dan nasib pemeluk agama lain dalam perspektif al-Qur?an,Disertasi,3/1/2021,3/8/2021,Sudah Kembali
pascasarjana,Dari Jihad Menuju Ijtihad,Buku Teks,3/1/2021,3/8/2021,Sudah Kembali
pascasarjana,Perselingkuhan Kiyai dan Kekuasaan,Buku Teks,3/1/2021,3/8/2021,Sudah Kembali
pascasarjana,Partai Keadilan Sejahtera : wajah baru Islam politik Indonesia,Buku Teks,3/1/2021,3/8/2021,Sudah Kembali
pascasarjana,"Partai, kebijakan dan demokrasi",Buku Teks,3/1/2021,3/8/2021,Sudah Kembali
,"Children, Adults, and Shared Responsibilities: Jewish, Christian and Muslim Perspectives",Buku Teks,3/1/2021,3/8/2021,Sudah Kembali
,Fiqh al-Islam wa adilatuhu,Buku Teks,4/30/2021,5/7/2021,Sudah Kembali
,Sensitivitas gender hakim kasasi dalam pertimbangan hukum Analisis Putusan Kasasi Tahun 2015,Tesis,4/30/2021,5/7/2021,Sudah Kembali
,Fiqh Munakahat,Buku Teks,4/30/2021,5/7/2021,Sudah Kembali
,Peradilan Islam dalam tatanan masyarakat Indonesia,Buku Teks,4/30/2021,5/7/2021,Sudah Kembali
,"Perlembagaan Hukum Islam Di Indonesia: akar sejarah, hambatan dan prospeknya",Buku Teks,4/30/2021,5/7/2021,Sudah Kembali
,Hukum Keluarga Di Dunia Islam Modern: Studi Perbandingan dan Kebijakan UU Modern dari Kitab-kitab Fikih,Buku Teks,4/30/2021,5/7/2021,Sudah Kembali
,Pajak dan zakatsebagai sumber keuangan daertah (regional public finance),Disertasi,4/30/2021,5/7/2021,Sudah Kembali
,Hukum keluarga Islam di dunia Islam,Buku Teks,4/28/2021,5/5/2021,Sudah Kembali
,"Media, Spiritualities and Social Change",Buku Teks,4/28/2021,5/5/2021,Sudah Kembali
,Spiritual Intelligance: membangkitkan kekuatan spiritual dan intuisi anda,Buku Teks,4/28/2021,5/5/2021,Sudah Kembali
,Heart steps: prayers and declarations for a creative life,Buku Teks,4/28/2021,5/5/2021,Sudah Kembali
,"Thinking, fast and slow",Buku Teks,4/28/2021,5/5/2021,Sudah Kembali
,Sex & Gender : an Introduction,Buku Teks,4/28/2021,5/5/2021,Sudah Kembali
,Perempuan hitam putih : pertarungan kodrat hidup vis a vis tafsir kebahagiaan,Buku Teks,4/28/2021,5/5/2021,Sudah Kembali
,Sifat-sifat Allah dalam perspektif ahlussunnah dan mu'tazilah,Disertasi,4/28/2021,5/5/2021,Sudah Kembali
,Konotasi nahwu aiurrumiyyah signifikansinya terhadap teori sastra Arab dan tradisi ekspresif para sufi,Disertasi,4/28/2021,5/5/2021,Sudah Kembali
,The Media Students Book,Buku Teks,4/28/2021,5/5/2021,Sudah Kembali
,Nuansa-nuansa komunikasi: meneropong politik dan budaya komunikasi masyarakat kontemporer,Buku Teks,4/28/2021,5/5/2021,Sudah Kembali
,Komunikasi massa,Buku Teks,4/28/2021,5/5/2021,Sudah Kembali
pascasarjana,Akulturasi Nilai - Nilai Persaudaraan Islam Model Dayah Aceh,Buku Teks,4/28/2021,5/5/2021,Sudah Kembali
pascasarjana,Kelengkapan tarikh Nabi Muhammad SAW,Buku Teks,4/27/2021,5/4/2021,Sudah Kembali
pascasarjana,Sirah Nabi : Buku Sejarah Muhammad SAW,Buku Teks,4/27/2021,5/4/2021,Sudah Kembali
pascasarjana,Problematika Fikih Kontemporer,Buku Teks,4/27/2021,5/4/2021,Sudah Kembali
pascasarjana,Perkawinan dalam hukum Islam dan Undang-Undang: perspektif fiqh munakahat dan UU No. 1/1974 tentang poligami dan problematikanya,Buku Teks,4/27/2021,5/4/2021,Sudah Kembali
pascasarjana,"Women, Family, and Gender in Islamic Law",Buku Teks,4/27/2021,5/4/2021,Sudah Kembali
pascasarjana,The family structure in Islam,Buku Teks,4/27/2021,5/4/2021,Sudah Kembali
pascasarjana,Urgensi Maslahat Mursalah Dalam Dialektika Pemikiran Hukum Islam,Buku Teks,4/27/2021,5/4/2021,Sudah Kembali
,Sejarah Dunia Yang Disembunyikan,Buku Teks,4/27/2021,5/4/2021,Sudah Kembali
,"Pemikiran Politik Islam Sjafruddin Prawiranegara (1911-1989) Good Governance, Civil Society dan Islam Transformatif",Disertasi,4/27/2021,5/4/2021,Sudah Kembali
,Terorisme dan jihad dalam perspektif hukum Islam,Disertasi,4/27/2021,5/4/2021,Sudah Kembali
pascasarjana,Penyederhanaan Mata Uang Dalam Axioma Ekonomi Islam,Disertasi,4/27/2021,5/4/2021,Sudah Kembali
pascasarjana,Paradigma pendidikan tinggi Islam dan relevansinya dengan pasar kerja di era global: sebuah studi terhadap kasus lulusan Fakultas Tarbiyah UIN Syarif Hidayatullah Jakarta di sekolah unggulan,Disertasi,4/27/2021,5/4/2021,Sudah Kembali
,Diskursus Pribumisasi Islam dalam dakwah kultural Abdurrahman Wahid : perspektif tindakan kominikatif Jurgen Habermas,Disertasi,4/27/2021,5/4/2021,Sudah Kembali
,Elektisisme Mohammed Arkoun dalam Konteks Pembacaan Al-Quran Kontemporer,Disertasi,4/27/2021,5/4/2021,Sudah Kembali
,Pemikiran Politik Islam. Studi pemikiran Abdullahi Ahmed an-Na'im tentang relasi Islam dan negara,Disertasi,4/26/2021,5/3/2021,Sudah Kembali
pascasarjana,Sosiologi Agama,Buku Teks,4/26/2021,5/3/2021,Sudah Kembali
pascasarjana,Critical Issues in Qualitative Research Methods,Buku Teks,4/26/2021,5/3/2021,Sudah Kembali
pascasarjana,Qualitative Research: A Guide to Design and Implementation,Buku Teks,4/26/2021,5/3/2021,Sudah Kembali
pascasarjana,Teori kritik sastra arab; klasik dan modern,Buku Teks,4/26/2021,5/3/2021,Sudah Kembali
pascasarjana,"Runtuhnya universalitas sosiologi barat: bongkar wacana atas: Islam vis a vis barat, Orientalisme, Postmodernisme, dan globalisme [terjemahan ?]",Buku Teks,4/26/2021,5/3/2021,Sudah Kembali
,Renaisans Islam Asia Tenggara : sejarah wacana dan kekuasaan,Buku Teks,4/23/2021,4/30/2021,Sudah Kembali
,A Short History of South-East Asia,Buku Teks,4/23/2021,4/30/2021,Sudah Kembali
,Kampus pembaharu menuju Universitas riset,Buku Teks,4/23/2021,4/30/2021,Sudah Kembali
,Prophetic Education Kontekstualisasi Filsafat dan Budaya Profetik dalam Pendidikan,Buku Teks,4/23/2021,4/30/2021,Sudah Kembali
,Proses perubahan IAIN menjadi UIN Syarif Hidayatullah Jakarta : rekaman media massa,Buku Teks,4/23/2021,4/30/2021,Sudah Kembali
,Paradigma baru pendidikan Islam: rekaman implementasi IAIN Indonesian Social Equity Project (IISEP) 2002-2007,Buku Teks,4/23/2021,4/30/2021,Sudah Kembali
,Pengantar kajian gender,Buku Teks,4/23/2021,4/30/2021,Sudah Kembali
,Komunikasi Politik : khalayak dan efek,Buku Teks,4/23/2021,4/30/2021,Sudah Kembali
,Teori Komunikasi,Buku Teks,4/23/2021,4/30/2021,Sudah Kembali
pascasarjana,Umdatul Ahkam: Kumpulan Hadis Hukum Yang Shahih,Buku Teks,4/23/2021,4/30/2021,Sudah Kembali
pascasarjana,Perempuan tertindas? Kajian hadis misoginis,Buku Teks,4/23/2021,4/30/2021,Sudah Kembali
pascasarjana,Etos studi kaum santri ; wajah baru pendidikan islam,Buku Teks,4/23/2021,4/30/2021,Belum Kembali
,Etika Hakim Dalam Penyelenggaraan Peradilan: Suatu Kajian Dalam Sistem Peradilan Islam,Buku Teks,4/23/2021,4/30/2021,Sudah Kembali
,Perkawinan Beda Agama :dalam syariat islam,Buku Teks,4/23/2021,4/30/2021,Sudah Kembali
,Perlindungan anak dalam agama Islam,Buku Teks,4/23/2021,4/30/2021,Sudah Kembali
,Hak Hadanah Pada Ayah: Analisis Yurisprudensi Mahkamah Agung,Tesis,4/23/2021,4/30/2021,Sudah Kembali
,Aneka masalah hukum perdata islam di indonesia,Buku Teks,4/23/2021,4/30/2021,Sudah Kembali
,Pencatatan Pernikahan: Dalam Perspektif Undang-Undang dan Hukum Islam,Buku Teks,4/23/2021,4/30/2021,Sudah Kembali
,"Epistemologi Inkar Sunnah: studi kritis pemikiran Rashad Khalifa, Edip Yuksel, dan Sam Gerrans",Tesis,4/23/2021,4/30/2021,Sudah Kembali
,Pajak dan zakatsebagai sumber keuangan daertah (regional public finance),Disertasi,4/23/2021,4/30/2021,Sudah Kembali
pascasarjana,Fiqh perempuan dalam perspektif Yusuf al-Qardawi,Tesis,4/23/2021,4/30/2021,Sudah Kembali
pascasarjana,Metode penelitian kombinasi: mixed methods,Buku Teks,4/23/2021,4/30/2021,Sudah Kembali
pascasarjana,Critical issues in qualitative research methods,Buku Teks,4/23/2021,4/30/2021,Sudah Kembali
pascasarjana,"Metodologi Penelitian Kualitatif: Pendekatan Positivistik, Rsaionalistik, Phenomenologik, dan Realisme Metaphisik Telaah Studi Teks dan Penelitian Agama",Buku Teks,4/23/2021,4/30/2021,Sudah Kembali
pascasarjana,Analisis Wacana Teori dan Metode,Buku Teks,4/23/2021,4/30/2021,Sudah Kembali
,"Muslim Reform in Southeast Asia : Perspectives from Malaysia, Indonesia and Singapore",Buku Teks,4/23/2021,4/30/2021,Sudah Kembali
,Islam di Muangthai : nasionalisme Melayu masyarakat Patani,Buku Teks,4/23/2021,4/30/2021,Sudah Kembali
,Islam in Southeast Asia,Buku Teks,4/23/2021,4/30/2021,Sudah Kembali
,Islam dan Dinamika Sosial Politik di Indonesia,Buku Teks,4/23/2021,4/30/2021,Sudah Kembali
,Islam in Southeast Asia,Buku Teks,4/22/2021,4/29/2021,Sudah Kembali
,"Muslim Reform in Southeast Asia : Perspectives from Malaysia, Indonesia and Singapore",Buku Teks,4/22/2021,4/29/2021,Sudah Kembali
,Islam di Muangthai : nasionalisme Melayu masyarakat Patani,Buku Teks,4/22/2021,4/29/2021,Sudah Kembali
,Rekonstruksi pemahaman jender dalam Islam: agenda sosio kultural dan polutik peran perem,Buku Teks,4/22/2021,4/29/2021,Sudah Kembali
,Kodrat perempuan dalam Islam,Buku Teks,4/22/2021,4/29/2021,Sudah Kembali
,Membela perempuan : menakar feminisme dengan nalar agama,Buku Teks,4/22/2021,4/29/2021,Sudah Kembali
,"Reinterpretasi gender: wanita dalam al-quran, hadis, dan tafsir",Buku Teks,4/22/2021,4/29/2021,Sudah Kembali
,Islam dan inspirasi kesetaraan gender,Buku Teks,4/22/2021,4/29/2021,Sudah Kembali
,Indahnya Islam : Menyuarakan Kesetaraan dan Keadilan Gender,Buku Teks,4/22/2021,4/29/2021,Sudah Kembali
21191200000057,Toleransi Beragama Berbasis Budaya Lokal,Disertasi,4/22/2021,4/29/2021,Sudah Kembali
21191200000057,Pendidikan Toleransi Beragama (Kajian atas Pembelajaran Agama Di Binus School Jakarta),Disertasi,4/22/2021,4/29/2021,Sudah Kembali
pascasarjana,Pola Pikir Abu Hanifah Dalam Menetapkan Istihsan Sebagai Dalil Hukum,Tesis,4/22/2021,4/29/2021,Sudah Kembali
pascasarjana,Kritik terhadap Istihsan : studi perbandi- ngan atas pandangan Imam Syafi'i dan Ibn Hazm,Tesis,4/22/2021,4/29/2021,Sudah Kembali
,Huquq al-Insan dirasah muqaranah fi al-nazariyah wa al-tatbiq,Buku Teks,4/22/2021,4/29/2021,Sudah Kembali
31181200000014,Ustaz populer di indonesia: kajian tentang brand di media sosial,Disertasi,4/22/2021,4/29/2021,Sudah Kembali
pascasarjana,Kelengkapan tarikh Nabi Muhammad,Buku Teks,4/22/2021,4/29/2021,Sudah Kembali
pascasarjana,Tafsir Al-Quran Tematik : Al-quran Dan Kebinekaan,Buku Teks,4/21/2021,4/28/2021,Sudah Kembali
pascasarjana,"Fatwa Hubungan Antaragama di Indonesia Kajian Kritis Tentang Karkateristik, Praktik, dan Implikasinya",Buku Teks,4/21/2021,4/28/2021,Sudah Kembali
pascasarjana,Wasathiyyah: wawasan Islam tentang moderasi beragama,Buku Teks,4/21/2021,4/28/2021,Sudah Kembali
pascasarjana,Daulah islamiyah dalam al-quran dan sunnah,Buku Teks,4/21/2021,4/28/2021,Sudah Kembali
,Reposisi hubungan Agama dan Negara : merajut kerukunan antarumat,Buku Teks,4/21/2021,4/28/2021,Sudah Kembali
21191200000057,"Syahr al-muwasat: kesabaran, ampunan, amal, dan solidaritas",Buku Teks,4/20/2021,4/27/2021,Sudah Kembali
,Efektifitas Pembelajaran Bahasa Arab Di Madrasah Tsanawiyah al-Hidayah : Studi Pendekatan Komunikatif,Tesis,4/20/2021,4/27/2021,Sudah Kembali
,Pembaharuan Hukum Islam Menurut Jamal Albanna,Disertasi,4/20/2021,4/27/2021,Sudah Kembali
,Periwayat syi'ah dalam kitab sahih al-bukhari dan sahih muslim,Disertasi,4/20/2021,4/27/2021,Sudah Kembali
,Penerapan Prinsip-Prinsip Jual Beli Online dalam Islam :studi kasus pada situs E-Commerce Islam di Indonesia,Tesis,4/20/2021,4/27/2021,Sudah Kembali
,Paradigma pengembangan keilmuan islam; perspektif uin malang,Buku Teks,4/20/2021,4/27/2021,Sudah Kembali
,"Hierarki ilmu; membangun rangka-pikir Islamisasi ilmu manurut al-Farabi, al-Ghazali Quthb aI-Din al-Svirazi",Buku Teks,4/20/2021,4/27/2021,Sudah Kembali
,Pengembangan ilmu-ilmu keislaman,Buku Teks,4/20/2021,4/27/2021,Sudah Kembali
,The Integration of Science and Religion in Search of a Paradigm,Buku Teks,4/20/2021,4/27/2021,Sudah Kembali
,Islamisasi ilmu-ilmu sosial,Buku Teks,4/20/2021,4/27/2021,Sudah Kembali
,Politik Islam,Buku Teks,4/19/2021,4/26/2021,Sudah Kembali
,Islam dalam perspektif sosio kultural,Buku Teks,4/19/2021,4/26/2021,Sudah Kembali
,Konsep takdir dalam al-Qur'an,Disertasi,4/16/2021,4/23/2021,Sudah Kembali
,Penafsiran ayat-ayat jender menurut Muhammad Quraish Shihab dalam tafsir al-Misbah,Disertasi,4/16/2021,4/23/2021,Sudah Kembali
,Putusan Mahkamah Konstitusi (MK) Terhadap Anak Hasil Nikah Sirri (Analisis Putusan Mahkamah Konstitusi N.46/PUU VIII/2010),Tesis,4/16/2021,4/23/2021,Sudah Kembali
,Aneka masalah hukum perdata islam di indonesia,Buku Teks,4/16/2021,4/23/2021,Sudah Kembali
,Fiqh al-Islam wa adilatuhu,Buku Teks,4/16/2021,4/23/2021,Sudah Kembali
,Fikih Perempuan Kontemporer,Buku Teks,4/16/2021,4/23/2021,Sudah Kembali
,Fiqih anak: metode Islam dalam mengasuh dan mendidik anak serta hukum-hukum yang berkaitan dengan aktifitas anak,Buku Teks,4/16/2021,4/23/2021,Sudah Kembali
,Pencatatan Pernikahan: Dalam Perspektif Undang-Undang dan Hukum Islam,Buku Teks,4/16/2021,4/23/2021,Sudah Kembali
,Kritik dan konsep pemikiran tasawuf menurut Hamka,Disertasi,4/16/2021,4/23/2021,Sudah Kembali
,Kebebasan beragama dalam perspektif hadis : analitik tematik,Disertasi,4/16/2021,4/23/2021,Sudah Kembali
,Penafsiran Ibn Arabi atas ayat-ayat Tauhid,Disertasi,4/16/2021,4/23/2021,Sudah Kembali
,Perspektif al-Qur'an tentang pluralitas umat beragama,Disertasi,4/16/2021,4/23/2021,Sudah Kembali
,Konotasi nahwu aiurrumiyyah signifikansinya terhadap teori sastra Arab dan tradisi ekspresif para sufi,Disertasi,4/16/2021,4/23/2021,Sudah Kembali
,Sifat-sifat Allah dalam perspektif ahlussunnah dan mu'tazilah,Disertasi,4/16/2021,4/23/2021,Sudah Kembali
,Metode Istinbat hukum Matlha'ul Anwar: studi analisis terhadap fatwa sosial keagamaan tahun 2001-2016,Tesis,4/16/2021,4/23/2021,Sudah Kembali
21191200000057,Metode A'isyah dalam kritik hadis,Disertasi,4/15/2021,4/22/2021,Sudah Kembali
,Masailul fiqhiyah : berbagai kasus yang dihadapi hukum Islam masa kini,Buku Teks,4/15/2021,4/22/2021,Sudah Kembali
,Kajian Islam Aktual,Buku Teks,4/15/2021,4/22/2021,Sudah Kembali
,Adopsi Hukum Islam Dalam Sistem Hukum Nasional,Buku Teks,4/15/2021,4/22/2021,Sudah Kembali
,Analisis Praktek dan Akibat Nikah Sirri di Tajur Bogor Dalam Perspektif Undang-Undang No.1 Tahun 1974 tentang Perkawinan,Tesis,4/15/2021,4/22/2021,Sudah Kembali
,"The 8th Habit : Melampaui Efektifitas, Menggapai Keagungan",Buku Teks,4/15/2021,4/22/2021,Sudah Kembali
pascasarjana,Sirah Nabi : Buku Sejarah Muhammad SAW,Buku Teks,4/15/2021,4/22/2021,Sudah Kembali
pascasarjana,Kelengkapan tarikh Nabi Muhammad,Buku Teks,4/15/2021,4/22/2021,Sudah Kembali
pascasarjana,Muhammad : his life based on the earliest resources,Buku Teks,4/15/2021,4/22/2021,Sudah Kembali
pascasarjana,Muhammad Sang Pembela,Buku Teks,4/15/2021,4/22/2021,Sudah Kembali
pascasarjana,Dinasti Abbasiyah,Buku Teks,4/15/2021,4/22/2021,Sudah Kembali
,Sikap Pengikut Salafi Wahabi Di Indonesia Dalam Masalah Khilafiyah,Disertasi,4/15/2021,4/22/2021,Sudah Kembali
,"Epistemologi Inkar Sunnah: studi kritis pemikiran Rashad Khalifa, Edip Yuksel, dan Sam Gerrans",Tesis,4/15/2021,4/22/2021,Sudah Kembali
pascasarjana,Ekonomi islam di tengah krisis ekonomi global,Buku Teks,4/15/2021,4/22/2021,Sudah Kembali
pascasarjana,Perilaku konsumen dalam pesrpektif imu ekonomi Islam,Buku Teks,4/15/2021,4/22/2021,Sudah Kembali
pascasarjana,Membangun sistem ekonomi alternatif; persepektif islam,Buku Teks,4/15/2021,4/22/2021,Sudah Kembali
pascasarjana,Islamisasi Ekonomi: suatu sketsa evaluasi dan prospek gerakan perekonomian Islam,Buku Teks,4/15/2021,4/22/2021,Sudah Kembali
pascasarjana,Ekonomi Islam : teori dan praktek,Buku Teks,4/15/2021,4/22/2021,Sudah Kembali
pascasarjana,Mengenal sistem ekonomi Islam,Buku Teks,4/15/2021,4/22/2021,Sudah Kembali
,Politics of Islamic identity in Southeast Asia,Buku Teks,4/14/2021,4/21/2021,Sudah Kembali
pascasarjana,Pembaruan hukum Islam dalam mazhab Syafii,Buku Teks,4/13/2021,4/20/2021,Sudah Kembali
,Pengembangan keterampilan membaca teks arab,Buku Teks,4/13/2021,4/20/2021,Sudah Kembali
,Tata bahasa arab sistematis; pendekatan baru mempelajari tata bahasa arab,Buku Teks,4/13/2021,4/20/2021,Sudah Kembali
,Hukum islam ; panormaan prinsip syariah dalam hukum indonesia,Buku Teks,4/13/2021,4/20/2021,Sudah Kembali
,Fiqh Munakahat,Buku Teks,4/13/2021,4/20/2021,Sudah Kembali
,Menghadapi soal-soal perkawinan,Buku Teks,4/13/2021,4/20/2021,Sudah Kembali
,Nalar Tekstual Ahli Hadis di Indonesia,Disertasi,4/13/2021,4/20/2021,Sudah Kembali
,Epistemologi tafsir kontemporer,Buku Teks,4/13/2021,4/20/2021,Sudah Kembali
pascasarjana,Sirat Al- Nabawiyah,Buku Teks,4/12/2021,4/19/2021,Sudah Kembali
pascasarjana,Metode tafsir Maudhui: dan cara penerapannya,Buku Teks,4/12/2021,4/19/2021,Sudah Kembali
pascasarjana,Ushul fiqh Jilid 1,Buku Teks,4/12/2021,4/19/2021,Sudah Kembali
pascasarjana,Fikih taysir: metode praktis mempelajari fikih=Fi Fiqh al-awlawiyat,Buku Teks,4/12/2021,4/19/2021,Sudah Kembali
pascasarjana,Introduction to Shariah and Islamic Jurisprudence,Buku Teks,4/12/2021,4/19/2021,Sudah Kembali
pascasarjana,Ilmu Ushul Fiqih Satu dan Dua,Buku Teks,4/12/2021,4/19/2021,Sudah Kembali
pascasarjana,Religiusitas dan kesehatan mental: studi pada aktivitas jama'ah tabligh Jakarta Selatan,Tesis,4/12/2021,4/19/2021,Belum Kembali
,The formation of Islamic Art,Buku Teks,4/12/2021,4/19/2021,Sudah Kembali
,"Understanding Islamic sciences : philosophy, theology, mysticism, morality, jurisprudence",Buku Teks,4/12/2021,4/19/2021,Sudah Kembali
,Diversity and pluralism in Islam: histocultural and contemporary discourses amongst muslims,Buku Teks,4/12/2021,4/19/2021,Sudah Kembali
,Ulama perempuan indonesia,Buku Teks,4/12/2021,4/19/2021,Sudah Kembali
,Studies In Islamic History And Institutions,Buku Teks,4/9/2021,4/16/2021,Sudah Kembali
,Islam in history,Buku Teks,4/9/2021,4/16/2021,Sudah Kembali
,Hikmah Abadi Revolusi Imam Husain,Buku Teks,4/9/2021,4/16/2021,Sudah Kembali
,"Historiografi Islam kontemporer: wacana, aktualitas, dan aktor sejarah",Buku Teks,4/9/2021,4/16/2021,Sudah Kembali
,Sejarah sosial Umat Islam,Buku Teks,4/9/2021,4/16/2021,Sudah Kembali
,History of the arab; rujukan induk dan paling otoritatif tentang sejarah peradaban isla,Buku Teks,4/9/2021,4/16/2021,Sudah Kembali
pascasarjana,Tasawuf Antara Agama Dan Filsafat,Buku Teks,4/9/2021,4/16/2021,Sudah Kembali
pascasarjana,"Nur Muhammad: pintu menuju Allah, telaah Sufistik atas pemikiran Syekh Yusuf Al-Nabhani",Buku Teks,4/9/2021,4/16/2021,Sudah Kembali
pascasarjana,"Tafsir al-Mishbah : pesan, kesan dan keserasian al-Qur?an vol. 7, 8",Buku Teks,4/9/2021,4/16/2021,Sudah Kembali
pascasarjana,Sirah Nabi : Buku Sejarah Muhammad SAW,Buku Teks,4/9/2021,4/16/2021,Sudah Kembali
pascasarjana,Fiqh al-Sirah al-Nabawiyah,Buku Teks,4/8/2021,4/15/2021,Sudah Kembali
pascasarjana,Kelengkapan tarikh Nabi Muhammad,Buku Teks,4/8/2021,4/15/2021,Sudah Kembali
pascasarjana,Tarikh Yaqubi,Buku Teks,4/8/2021,4/15/2021,Sudah Kembali
pascasarjana,mukhtasar sirah al-rasul,Buku Teks,4/8/2021,4/15/2021,Sudah Kembali
pascasarjana,Ulumul Hadis,Buku Teks,4/8/2021,4/15/2021,Sudah Kembali
pascasarjana,lImu hadits,Buku Teks,4/8/2021,4/15/2021,Sudah Kembali
pascasarjana,Ulumul hadis,Buku Teks,4/8/2021,4/15/2021,Sudah Kembali
pascasarjana,Antologi ilmu hadits,Buku Teks,4/8/2021,4/15/2021,Sudah Kembali
pascasarjana,Mengenal Ilmu Hadis : menjaga kemurnian hadis dengan mengkaji ilmu hadis,Buku Teks,4/8/2021,4/15/2021,Sudah Kembali
,Hukum Keluarga Di Dunia Islam Modern: Studi Perbandingan dan Kebijakan UU Modern dari Kitab-kitab Fikih,Buku Teks,4/8/2021,4/15/2021,Sudah Kembali
,Fiqh al-Islam wa adilatuhu,Buku Teks,4/8/2021,4/15/2021,Sudah Kembali
,Masail fiqhiyah: kajian hukum Islam kontemporer,Buku Teks,4/8/2021,4/15/2021,Sudah Kembali
,Perlindungan anak dalam agama Islam,Buku Teks,4/8/2021,4/15/2021,Sudah Kembali
,Fiqh Keluarga: pedoman berkeluarga dalam Islam,Buku Teks,4/8/2021,4/15/2021,Sudah Kembali
,Hak Hadanah Pada Ayah: Analisis Yurisprudensi Mahkamah Agung,Tesis,4/8/2021,4/15/2021,Sudah Kembali
,Demokrasi Religius,Buku Teks,4/8/2021,4/15/2021,Sudah Kembali
,Demokrasi di persimpangan makna: respon intelektual muslim Indonesia terhadap konsep demokrasi,Buku Teks,4/8/2021,4/15/2021,Sudah Kembali
,Demokrasi dalam PKS,Tesis,4/8/2021,4/15/2021,Sudah Kembali
,Ideal and ideologies and the democratic ideal: a reader 2nd ed.,Buku Teks,4/8/2021,4/15/2021,Sudah Kembali
,Theories of political economy,Buku Teks,4/8/2021,4/15/2021,Sudah Kembali
,Berpetualang dalam Marxisme,Buku Teks,4/8/2021,4/15/2021,Sudah Kembali
,Political thinking,Buku Teks,4/8/2021,4/15/2021,Sudah Kembali
,Interpretation of cultures,Buku Teks,4/8/2021,4/15/2021,Sudah Kembali
,Gender Before Human Right In Islam and International Law,Buku Teks,4/8/2021,4/15/2021,Sudah Kembali
,Dimensi-dimensi hak asasi manusia dalam kurikulum persekolahan Indonesia,Buku Teks,4/8/2021,4/15/2021,Sudah Kembali
,Pengantar Teori-Teori Sosial: Dari teori fungsionalisme hingga post-modernisme,Buku Teks,4/7/2021,4/14/2021,Sudah Kembali
,Politics of Islamic identity in Southeast Asia,Buku Teks,4/7/2021,4/14/2021,Sudah Kembali
pascasarjana,Denyut Islam Di Eropa,Buku Teks,4/7/2021,4/14/2021,Sudah Kembali
pascasarjana,Lectures on the philosophy of religion Volume III,Buku Teks,4/7/2021,4/14/2021,Sudah Kembali
pascasarjana,"Etika pembebasan : pilihan karangan tentang agama, kebudayaan, sejarah dan ilmu pengetahuan",Buku Teks,4/7/2021,4/14/2021,Sudah Kembali
pascasarjana,al-Siyarah al-Nabawiyah,Buku Teks,4/7/2021,4/14/2021,Sudah Kembali
pascasarjana,the Elementary Form of The Religious Life : sejarah bentuk agama-agama yang paling dasar,Buku Teks,4/7/2021,4/14/2021,Sudah Kembali
pascasarjana,Sosiologi Agama,Buku Teks,4/7/2021,4/14/2021,Sudah Kembali
,A critical exposition,Buku Teks,4/7/2021,4/14/2021,Sudah Kembali
,After God: the future of religion,Buku Teks,4/7/2021,4/14/2021,Sudah Kembali
,Medieval Heresies,Buku Teks,4/7/2021,4/14/2021,Sudah Kembali
,Kerukunan antar umat beragama di Indonesia dari era Orde Baru hingga reformasi : studi kebijakan pemerintah 1966-207,Disertasi,4/7/2021,4/14/2021,Sudah Kembali
,Tafsir Minoritas: Diskursus Non-Muslim dalam al- Qur'an Perspektif Abdullah Saeed dan Farid Esack,Tesis,4/7/2021,4/14/2021,Sudah Kembali
,Haqiqat al-Islam fi Alam Mutaghayar,Buku Teks,4/7/2021,4/14/2021,Sudah Kembali
,Konsep riddah dan hak-hak asasi manusia dalam tinjauan hukum Islam,Tesis,4/7/2021,4/14/2021,Sudah Kembali
,Konotasi nahwu aiurrumiyyah signifikansinya terhadap teori sastra Arab dan tradisi ekspresif para sufi,Disertasi,4/7/2021,4/14/2021,Sudah Kembali
,Sifat-sifat Allah dalam perspektif ahlussunnah dan mu'tazilah,Disertasi,4/7/2021,4/14/2021,Sudah Kembali
,Anthropology of religion,Buku Teks,4/7/2021,4/14/2021,Sudah Kembali
,"Agama dan konflik Sosial : Studi kerukunan umat beragama, radikalisme, dan konflik antarumat beragama",Buku Teks,4/7/2021,4/14/2021,Sudah Kembali
,Konflik dan Penyelesaian Pendirian Rumah Ibadat,Buku Teks,4/7/2021,4/14/2021,Sudah Kembali
,Agama dan Dialog antar Peradaban,Buku Teks,4/7/2021,4/14/2021,Sudah Kembali
pascasarjana,Pengantar studi al-quran dan al-hadist,Buku Teks,4/7/2021,4/14/2021,Sudah Kembali
,Nalar Tekstual Ahli Hadis di Indonesia,Disertasi,4/7/2021,4/14/2021,Sudah Kembali
,Epistemologi tafsir kontemporer,Buku Teks,4/7/2021,4/14/2021,Sudah Kembali
,Mohammed The Messenger of Allah,Buku Teks,4/6/2021,4/13/2021,Sudah Kembali
pascasarjana,Teroris membajak islam,Buku Teks,4/6/2021,4/13/2021,Sudah Kembali
pascasarjana,Jihad,Buku Teks,4/6/2021,4/13/2021,Sudah Kembali
pascasarjana,"Jihad Melawan Teror: Meluruskan Kesalafahaman Khilafah, Takfir, jihad, Hakimiyah, Jahiliyah, dan Ekstermitas",Buku Teks,4/6/2021,4/13/2021,Sudah Kembali
pascasarjana,Fiqh Jihad : Upaya Mewujudkan Darul Islam Antara Konsep dan Pelaksanaanya,Buku Teks,4/6/2021,4/13/2021,Sudah Kembali
pascasarjana,Ekologi Berwawasan Gender dalam Perspektif Al-Quran,Buku Teks,4/5/2021,4/12/2021,Sudah Kembali
pascasarjana,Wanita Islam Indonesia dalam kajian tekstual dan kontekstual,Buku Teks,4/5/2021,4/12/2021,Sudah Kembali
pascasarjana,Fiqh perbandingan masalah pernikahan,Buku Teks,4/5/2021,4/12/2021,Sudah Kembali
