Username,Judul,Tipe Koleksi,Tanggal Dipinjam,Harus Kembali,Status Pengembalian
pascasarjana,Toleransi Beragama Berbasis Budaya Lokal,Disertasi,6/17/2021,6/24/2021,Sudah Kembali
pascasarjana,Implementasi budaya toleransi dalam pendidikan agama,Disertasi,6/17/2021,6/24/2021,Sudah Kembali
,Tafsir al-Kashshaf an haqaiq ghawamid al-tanzil wa uyun al-aqawil,Buku Teks,6/17/2021,6/24/2021,Sudah Kembali
,Muhammad at Medina,Buku Teks,6/16/2021,6/23/2021,Sudah Kembali
,Pocket of Aquinas the-,Buku Teks,6/16/2021,6/23/2021,Sudah Kembali
,Pembangunan berwawasan lingkungan dalam perspektif Islam : kajian tentang sustainable development di Indonesia,Disertasi,6/16/2021,6/23/2021,Sudah Kembali
,Pengantar ilmu hukum,Buku Teks,6/16/2021,6/23/2021,Sudah Kembali
,Sensitivitas gender hakim kasasi dalam pertimbangan hukum Analisis Putusan Kasasi Tahun 2015,Tesis,6/16/2021,6/23/2021,Sudah Kembali
,Revolusi Tak Kunjung Selesai: Potret Indonesia Masa Kini,Buku Teks,6/16/2021,6/23/2021,Sudah Kembali
,Good governance: a workable solution for Indonesia?,Buku Teks,6/16/2021,6/23/2021,Sudah Kembali
,Prasejarah kepulauan Indo-Malaysia,Buku Teks,6/16/2021,6/23/2021,Sudah Kembali
,Indonesia in transition : social aspects reformasi and crisis,Buku Teks,6/16/2021,6/23/2021,Sudah Kembali
,Selamat Berpisah: sampai berjumpa di saat yang lebih baik (dokumenter runtuhmya Hindia Belanda,Buku Teks,6/16/2021,6/23/2021,Sudah Kembali
21191200000040,Fiqh al-Islam wa adilatuhu,Buku Teks,6/15/2021,6/22/2021,Sudah Kembali
21191200000040,Fiqh al-Islam wa adilatuhu,Buku Teks,6/15/2021,6/22/2021,Sudah Kembali
pascasarjana,Menuju Pemahaman Islam Yang Kaffah,Buku Teks,6/15/2021,6/22/2021,Sudah Kembali
pascasarjana,Inilah islam : upaya memahami konsep-konsep dasar islam,Buku Teks,6/15/2021,6/22/2021,Sudah Kembali
pascasarjana,Toleransi Beragama Berbasis Budaya Lokal,Disertasi,6/15/2021,6/22/2021,Sudah Kembali
pascasarjana,Pendidikan Toleransi Beragama (Kajian atas Pembelajaran Agama Di Binus School Jakarta),Disertasi,6/15/2021,6/22/2021,Sudah Kembali
pascasarjana,Rasionalitas bahasa: upaya menafsirkan al-Quran dengan pendekatan kebahasaan,Buku Teks,6/15/2021,6/22/2021,Sudah Kembali
,Demokrasi Religius,Buku Teks,6/15/2021,6/22/2021,Sudah Kembali
,"Kebangkitan Kelas Menengah Santri : dari Tradisionalisme, Liberalisme, Posttradisionalisme, Fundamentalisme",Buku Teks,6/15/2021,6/22/2021,Sudah Kembali
pascasarjana,Jaringan Ulama,Buku Teks,6/15/2021,6/22/2021,Sudah Kembali
pascasarjana,Kajian Semantik Arab Klasik dan Kontemporer,Buku Teks,6/15/2021,6/22/2021,Sudah Kembali
pascasarjana,Strukturalisme Levi-Strauss Mitos dan karya sastra,Buku Teks,6/15/2021,6/22/2021,Sudah Kembali
pascasarjana,Pengantar Metodologi Pengajaran Sastra,Buku Teks,6/15/2021,6/22/2021,Sudah Kembali
pascasarjana,Membaca Sastra Dengan Ancangan Literasi Kritis,Buku Teks,6/15/2021,6/22/2021,Sudah Kembali
,Mengatasi Stres Melalui Spriritualitas dan Regulasi Diri: Studi pada Mahasiswa Kedokteran di DKI Jakarta,Disertasi,6/15/2021,6/22/2021,Sudah Kembali
,Konsep,Disertasi,6/15/2021,6/22/2021,Sudah Kembali
,The great theft; wresteling islam from the extremists,Buku Teks,6/14/2021,6/21/2021,Sudah Kembali
,Konstruksi Baru Budaya Hukum Hakim Berbasis Hukum Progresif,Buku Teks,6/14/2021,6/21/2021,Sudah Kembali
,Peradilan Pidana Anak Di Indonesia : Pengembangan Diversi dan Restorative Justice,Buku Teks,6/14/2021,6/21/2021,Sudah Kembali
,Reformasi Hukum Islam di Indonesia,Buku Teks,6/14/2021,6/21/2021,Sudah Kembali
,Intelektualisme pesantren: potret tokoh dan cakrawala pemikiran di era perkembangan pesantren,Buku Teks,6/14/2021,6/21/2021,Sudah Kembali
,Intelektualisme pesantren: potret tokoh dan cakrawala pemikiran di era keemasan pesantren (Seri 1 - 3),Buku Teks,6/14/2021,6/21/2021,Sudah Kembali
,IAIN Medernisasi Islam di Indonesia,Buku Teks,6/14/2021,6/21/2021,Sudah Kembali
,Pesantren Studies 2a Buku II : Kosmopolitanisme Peradaban Kaum Santri Di Masa Kolonial,Buku Teks,6/14/2021,6/21/2021,Sudah Kembali
,Pergulatan pesantren dan demokrasi,Buku Teks,6/14/2021,6/21/2021,Sudah Kembali
,Menemukan sejarah: wacana pergerakan Islam di Indonesia,Buku Teks,6/14/2021,6/21/2021,Sudah Kembali
,Beberapa aspek tentang Islam di Indonesia abad ke-19,Buku Teks,6/14/2021,6/21/2021,Sudah Kembali
,Islamisasi Kerajaan Gowa: abad XVI sampai XVII,Buku Teks,6/14/2021,6/21/2021,Sudah Kembali
,Pertumbuhan dan perkembangan kota-kota muslim di Indonesia: dari abad XIII sampai XVIII masehi,Buku Teks,6/14/2021,6/21/2021,Sudah Kembali
,Metode penelitian kombinasi: mixed methods,Buku Teks,6/14/2021,6/21/2021,Sudah Kembali
,Metode Penelitian Sosial: Suatu Teknik Penelitian Bidang Kesejahteraan Sosial dan Ilmu Sosial Lainnya,Buku Teks,6/14/2021,6/21/2021,Sudah Kembali
,al-Zamakhshari,Buku Teks,6/14/2021,6/21/2021,Sudah Kembali
pascasarjana,"Hierarki ilmu; membangun rangka-pikir Islamisasi ilmu manurut al-Farabi, al-Ghazali Quthb aI-Din al-Svirazi",Buku Teks,6/14/2021,6/21/2021,Sudah Kembali
pascasarjana,Panorama Filsafat Islam Menembus Batas Waktu,Buku Teks,6/14/2021,6/21/2021,Sudah Kembali
pascasarjana,Sacred canopy: elements of a sociological theory of religion THE-,Buku Teks,6/14/2021,6/21/2021,Sudah Kembali
pascasarjana,Ulama in contemporary Islam: custodian of change THE,Buku Teks,6/14/2021,6/21/2021,Sudah Kembali
pascasarjana,Kebenaran islam menurut mantan pendeta; sebuah tinjauan teologi kritis,Buku Teks,6/14/2021,6/21/2021,Sudah Kembali
pascasarjana,Sosiologi Agama,Buku Teks,6/14/2021,6/21/2021,Sudah Kembali
,Mazhab tafsir: dari aliran klasik hingga modern,Buku Teks,6/14/2021,6/21/2021,Sudah Kembali
,Muhammad Abid al-Jabiri dan turats Arab : kajian terhadap metode dan pemikirannya,Tesis,6/14/2021,6/21/2021,Sudah Kembali
,Kant and The Problem of Metaphysics,Buku Teks,6/14/2021,6/21/2021,Sudah Kembali
,Essays in existentialism,Buku Teks,6/14/2021,6/21/2021,Sudah Kembali
pascasarjana,Kearifan lokal budaya Bugis dan pluralisme: studi pendidikan karakter pada Perguruan Tinggi di Kota Palopo tahun 2017-2020,Disertasi,6/14/2021,6/21/2021,Sudah Kembali
,Urgensi Maslahat Mursalah Dalam Dialektika Pemikiran Hukum Islam,Buku Teks,6/11/2021,6/18/2021,Sudah Kembali
pascasarjana,Living hadith pernikahan: studi antropologi hadis dalam tradisi Islam Sasak Lombok,Disertasi,6/11/2021,6/18/2021,Sudah Kembali
pascasarjana,Living hadith pernikahan: studi antropologi hadis dalam tradisi Islam Sasak Lombok,Disertasi,6/11/2021,6/18/2021,Sudah Kembali
pascasarjana,Tafsir Minoritas: Diskursus Non-Muslim dalam al- Qur'an Perspektif Abdullah Saeed dan Farid Esack,Tesis,6/11/2021,6/18/2021,Sudah Kembali
pascasarjana,Tafsir Minoritas: Diskursus Non-Muslim dalam al- Qur'an Perspektif Abdullah Saeed dan Farid Esack,Tesis,6/11/2021,6/18/2021,Sudah Kembali
,Problematika Fikih Kontemporer,Buku Teks,6/11/2021,6/18/2021,Sudah Kembali
,Membongkar fiqh negara: wacana keadilan gender dalam hukum keluarga Islam,Buku Teks,6/11/2021,6/18/2021,Sudah Kembali
,Hukum Keluarga Di Dunia Islam Modern: Studi Perbandingan dan Kebijakan UU Modern dari Kitab-kitab Fikih,Buku Teks,6/11/2021,6/18/2021,Sudah Kembali
,Hak-hak perempuan pasca perceraian: analisis pertimbangan Hakim dalam Putusan Pengadilan Agama Padangsidimpuan,Tesis,6/11/2021,6/18/2021,Sudah Kembali
pascasarjana,"Al-Qur an bukan kitab sejarah : seni, sastra dan moralis dalam kisah-kisah Al - Qur an",Buku Teks,6/11/2021,6/18/2021,Sudah Kembali
pascasarjana,Kisah-kisah israiliyat dalam tafsir munir,Buku Teks,6/11/2021,6/18/2021,Sudah Kembali
,Kepemimpinan Kiai Di Lembaga Pendidikan Modern,Tesis,6/11/2021,6/18/2021,Sudah Kembali
,Sufism and Deconstruction. A comparative study of Derrida and Ibn Arabi,Buku Teks,6/11/2021,6/18/2021,Sudah Kembali
,God and Logic in Islam,Buku Teks,6/11/2021,6/18/2021,Sudah Kembali
,Suhrawardi dan Filsafat illuminasi : pencerahan ilmu pengetahuan,Buku Teks,6/11/2021,6/18/2021,Sudah Kembali
,Filsafat Agama 1,Buku Teks,6/11/2021,6/18/2021,Sudah Kembali
21191200000057,Autentitas Hadis Nabi Studi Riwayat Nafi' Mawla Ibn 'Umar dalam Kitab Al-Sahihayn,Disertasi,6/11/2021,6/18/2021,Sudah Kembali
21191200000057,Perempuan periwayat hadis: studi kitab Arba'in Abu Al-Faid Muhammad Yasin Bin Isa Al-Fadani Al-Makki,Tesis,6/11/2021,6/18/2021,Sudah Kembali
21191200000057,Interaksi Sosial Dalam Periwayatan Hadis (studi hadis-hadis isra'iliyat Abu Hurairah),Tesis,6/11/2021,6/18/2021,Sudah Kembali
pascasarjana,Ayat-ayat politik: studi kritid penafsiran Muhammad Asad (1900-1992),Buku Teks,6/11/2021,6/18/2021,Sudah Kembali
,Pribumisasi islam : studi atas pembaharuan pemikiran abdurrahman wahid,Tesis,6/11/2021,6/18/2021,Sudah Kembali
,Nahdlatul Ulama: dari Politik Kekuasaan sampai Pemikiran Keagamaan,Buku Teks,6/11/2021,6/18/2021,Sudah Kembali
,"Islam Ahlussunnah wal Jamaah di Indonesia : sejarah, pemikiran, dan dinamika Nahdlatul Ulama",Buku Teks,6/11/2021,6/18/2021,Sudah Kembali
,Mencari Islam autentik: dari nalar puitis Iqbal hingga nalar kritis Arkoun,Buku Teks,6/11/2021,6/18/2021,Sudah Kembali
,Membumikan Islam Nusantara,Buku Teks,6/11/2021,6/18/2021,Sudah Kembali
pascasarjana,"Musa, Alquran dan Bibel : pendekatan Intertekstual-Interkoneksitas Muhammad Izzah Darwazah Terhadap Kisah Nabi Musa",Buku Teks,6/10/2021,6/17/2021,Sudah Kembali
pascasarjana,"Musa, Alquran dan Bibel : pendekatan Intertekstual-Interkoneksitas Muhammad Izzah Darwazah Terhadap Kisah Nabi Musa",Buku Teks,6/10/2021,6/17/2021,Sudah Kembali
,Persebaran Ajaran Tasawuf Falsafi di Jawa Abad 18-20 (Kajian Teks dan Konteks),Disertasi,6/10/2021,6/17/2021,Sudah Kembali
,Tasawuf jantung islam,Buku Teks,6/10/2021,6/17/2021,Sudah Kembali
,"Tasawuf sebagai kritik sosial: mengedepankan Islam sebagai inspirasi, bukan aspirasi",Buku Teks,6/10/2021,6/17/2021,Sudah Kembali
,"Tasawuf sebagai kritik sosial: mengedepankan Islam sebagai inspirasi, bukan aspirasi",Buku Teks,6/10/2021,6/17/2021,Sudah Kembali
,Tasawuf nusantara: rangakaian mutiara sufi terkemuka,Buku Teks,6/10/2021,6/17/2021,Sudah Kembali
,Qawl al-fasl fi hukm al-ihtifal bi mawlid khayr al-rasul,Buku Teks,6/10/2021,6/17/2021,Sudah Kembali
21191200000040,Fiqh al-Islam wa adilatuhu,Buku Teks,6/9/2021,6/16/2021,Sudah Kembali
,Filsafat Hukum Islam : Dalam Dua Pertanyaan,Buku Teks,6/9/2021,6/16/2021,Sudah Kembali
,Fiqh Minoritas : Fiqh al-Aqalliyat dan Evolusi Maqashid al-Syariyahdari Konsep ke Pendekatan,Buku Teks,6/9/2021,6/16/2021,Sudah Kembali
,al-Ashr al-Abbasiyyi,Buku Teks,6/9/2021,6/16/2021,Sudah Kembali
,History of the arab; rujukan induk dan paling otoritatif tentang sejarah peradaban isla,Buku Teks,6/9/2021,6/16/2021,Sudah Kembali
,Biografi Imam Abu Hanifah,Buku Teks,6/9/2021,6/16/2021,Sudah Kembali
,al-Alam al-Islami fi al-Asr al-Abbasi,Buku Teks,6/9/2021,6/16/2021,Sudah Kembali
,A History Of Philosophy Vol.IX,Buku Teks,6/8/2021,6/15/2021,Sudah Kembali
,Mysticism of sound and music: the sufi teaching of Hazrat Inayat Khan,Buku Teks,6/8/2021,6/15/2021,Sudah Kembali
,Ibn Taimiyah Versus Para Filosof,Buku Teks,6/8/2021,6/15/2021,Sudah Kembali
,Hukum perlindungan anak dan penghapusan kekerasan dalam rumah tangga,Buku Teks,6/7/2021,6/14/2021,Sudah Kembali
,Pembaruan hukum perkawinan di Indonesia,Buku Teks,6/7/2021,6/14/2021,Sudah Kembali
,Pengantar ilmu hukum,Buku Teks,6/7/2021,6/14/2021,Sudah Kembali
,Hak Hadanah Pada Ayah: Analisis Yurisprudensi Mahkamah Agung,Tesis,6/7/2021,6/14/2021,Sudah Kembali
,Keadilan hukum Dalam Berbagai aspek hukum Nasional,Buku Teks,6/7/2021,6/14/2021,Sudah Kembali
,Hukum pembuktian di peradilan agama,Buku Teks,6/7/2021,6/14/2021,Sudah Kembali
,Contextual Teaching And Learning: Menjadikan Kegiatan Belajar Mengajar Mengasyilkan dan Bermakna,Buku Teks,6/7/2021,6/14/2021,Sudah Kembali
,Maslahah Mursalah Menurut al-Ghazali dan relevansinya dengan Pembaharuan Hukum Islam,Disertasi,6/4/2021,6/11/2021,Sudah Kembali
,Konsep sadd al-dzari'ah Imam Malik dan relevansinya dengan pembaharuan hukum Islam,Disertasi,6/4/2021,6/11/2021,Sudah Kembali
,"Agency, structure, and international politics : from ontology to empirical inquiry",Buku Teks,6/4/2021,6/11/2021,Sudah Kembali
,Southeast ASIA Zakat Movement,Buku Teks,6/4/2021,6/11/2021,Sudah Kembali
,Zakat Dan Pengentasan Kemiskinan,Buku Teks,6/4/2021,6/11/2021,Sudah Kembali
,The Shift in Zakat Practice in Indonesia : from piety to an Islamic socio-political-economic system,Buku Teks,6/4/2021,6/11/2021,Sudah Kembali
pascasarjana,Pengantar kajian gender,Buku Teks,6/4/2021,6/11/2021,Sudah Kembali
pascasarjana,Tafsir feminis versus Tafsir Patriarki,Buku Teks,6/4/2021,6/11/2021,Sudah Kembali
pascasarjana,Delusi kesetaraan gender,Buku Teks,6/4/2021,6/11/2021,Sudah Kembali
pascasarjana,Membiarkan Berbeda?,Buku Teks,6/4/2021,6/11/2021,Sudah Kembali
pascasarjana,Gender voices: telaah kritis relasi bahasa-gender,Buku Teks,6/4/2021,6/11/2021,Sudah Kembali
pascasarjana,Kesusastraan Arab: pengantar . . .,Buku Teks,6/4/2021,6/11/2021,Sudah Kembali
,Metode Riset Kuantitatif,Buku Teks,6/4/2021,6/11/2021,Sudah Kembali
,Metode penelitian,Buku Teks,6/4/2021,6/11/2021,Sudah Kembali
,Metode Penelitian sosial,Buku Teks,6/4/2021,6/11/2021,Sudah Kembali
,Prosedur Penelitian: Suatu Pendekatan Praktek,Buku Teks,6/4/2021,6/11/2021,Sudah Kembali
,Dasar-Dasar Metodologi Penelitian Kwantitatif Dalam Pendidikan,Buku Teks,6/4/2021,6/11/2021,Sudah Kembali
,"Educational research methodology : Panduan lengkap teori, aplikasi, dan contoh kasus",Buku Teks,6/4/2021,6/11/2021,Sudah Kembali
pascasarjana,Living hadith pernikahan: studi antropologi hadis dalam tradisi Islam Sasak Lombok,Disertasi,6/3/2021,6/10/2021,Sudah Kembali
pascasarjana,Tafsir Minoritas: Diskursus Non-Muslim dalam al- Qur'an Perspektif Abdullah Saeed dan Farid Esack,Tesis,6/3/2021,6/10/2021,Sudah Kembali
pascasarjana,Pendidikan Karakter TNI Dalam Bingkai Modernisasi,Disertasi,6/3/2021,6/10/2021,Sudah Kembali
pascasarjana,Pendidikan Toleransi Beragama (Kajian atas Pembelajaran Agama Di Binus School Jakarta),Disertasi,6/3/2021,6/10/2021,Sudah Kembali
,Kernel of the Kernel: concerning the wayfaring and spiritual journey of the people of intellect,Buku Teks,6/3/2021,6/10/2021,Sudah Kembali
,Muslim intellectual : a study of al-Ghazali,Buku Teks,6/3/2021,6/10/2021,Sudah Kembali
,the hermeneutics reader,Buku Teks,6/3/2021,6/10/2021,Sudah Kembali
,Integrasi ilmu agama dan ilmu umum,Buku Teks,6/3/2021,6/10/2021,Sudah Kembali
,the theology of the early greek philosophers,Buku Teks,6/3/2021,6/10/2021,Sudah Kembali
,Pembaharuan Hukum Islam Menurut Jamal Albanna,Disertasi,6/3/2021,6/10/2021,Sudah Kembali
pascasarjana,Mukjizat Al-Quran : ditinjau dari aspek kebahasaan isyarat ilmiah dan pemberitaan gaib,Buku Teks,6/3/2021,6/10/2021,Sudah Kembali
pascasarjana,Meretas kesarjanaan kritis al-Quran: teori hermeneutika Nasr Abu Zayd,Buku Teks,6/3/2021,6/10/2021,Sudah Kembali
pascasarjana,Ayat-ayat politik: studi kritid penafsiran Muhammad Asad (1900-1992),Buku Teks,6/3/2021,6/10/2021,Sudah Kembali
pascasarjana,Teori Interprestasi Al-QurAn,Buku Teks,6/3/2021,6/10/2021,Sudah Kembali
,"""Bank syari'ah, dari teori ke praktik = islamic banking""",Buku Teks,6/2/2021,6/9/2021,Sudah Kembali
,"Hukum ekonomi Islam: sejarah, teori dan konsep",Buku Teks,6/2/2021,6/9/2021,Sudah Kembali
,Hukum ekonomi Syariah,Buku Teks,6/2/2021,6/9/2021,Sudah Kembali
,Fiqh Muamalah,Buku Teks,6/2/2021,6/9/2021,Sudah Kembali
pascasarjana,Pendidikan Karakter TNI Dalam Bingkai Modernisasi,Disertasi,6/2/2021,6/9/2021,Sudah Kembali
,"Pengalaman Beragama, Reseliensi Dan Kebahagiaan Dalam Perspektif Psikospiritual (Studi Pada Pengamal Dzikrul Ghofilin)",Disertasi,7/27/2021,8/3/2021,Belum Kembali
,"the seven steps of spiritual quotient: jalur praktis mencapai tujuan, kesuksesan dan kebahagiaan",Buku Teks,7/27/2021,8/3/2021,Sudah Kembali
,Tafsir Al-Ma'arif Tadabbur ayat-ayat Al-Qur'an untuk kebahagiaan & kemuliaan hidup,Buku Teks,7/27/2021,8/3/2021,Sudah Kembali
,Perempuan hitam putih : pertarungan kodrat hidup vis a vis tafsir kebahagiaan,Buku Teks,7/27/2021,8/3/2021,Sudah Kembali
pascasarjana,Perubahan orientasi pondok pesantren salafiyah terhadap perilaku keagamaan masyarakat,Buku Teks,7/16/2021,7/30/2021,Sudah Kembali
pascasarjana,Intelektualisme pesantren: potret tokoh dan cakrawala pemikiran di era keemasan pesantren (Seri 1 - 3),Buku Teks,7/16/2021,7/30/2021,Sudah Kembali
pascasarjana,Bilik-Bilik Pesantren,Buku Teks,7/16/2021,7/30/2021,Sudah Kembali
pascasarjana,Dinamika pendidikan islam di asia tenggara,Buku Teks,7/16/2021,7/30/2021,Sudah Kembali
pascasarjana,Pemberdayaan Pendidikan Islam di Indonesia,Buku Teks,7/16/2021,7/30/2021,Sudah Kembali
pascasarjana,Esei-esei intelektual muslim dan pendidikan Islam,Buku Teks,7/16/2021,7/30/2021,Sudah Kembali
pascasarjana,Madrasah: dalam Politik Pendidikan di Indonesia,Buku Teks,7/16/2021,7/30/2021,Sudah Kembali
pascasarjana,Membebaskan pendidikan Islam,Buku Teks,7/16/2021,7/30/2021,Sudah Kembali
pascasarjana,Sejarah pertumbuhan dan pembaruan pendidikan Islam di Indonesia,Buku Teks,7/16/2021,7/30/2021,Sudah Kembali
pascasarjana,,Buku Teks,7/16/2021,7/30/2021,Sudah Kembali
pascasarjana,Politik Pendidikan Nasional,Buku Teks,7/16/2021,7/30/2021,Sudah Kembali
pascasarjana,Mixed methods research for nursing and the health sciences,Buku Teks,10/1/2021,10/8/2021,Sudah Kembali
pascasarjana,Metode penelitian kombinasi: mixed methods,Buku Teks,10/1/2021,10/8/2021,Sudah Kembali
pascasarjana,"Metode penelitian kuantitatif, kualitatif dan R&D",Buku Teks,10/1/2021,10/8/2021,Sudah Kembali
pascasarjana,Metodologi penelitian sosial,Buku Teks,10/1/2021,10/8/2021,Sudah Kembali
,Menguji kembali keakuratan metode kritik hadis,Buku Teks,10/1/2021,10/8/2021,Sudah Kembali
,Oposisi penulisan hadis di Masa Islam Awal,Buku Teks,10/1/2021,10/8/2021,Sudah Kembali
,Hadis dan Orientalis: perspektif ulama dan para orientalis tentang hadis Nabi,Buku Teks,10/1/2021,10/8/2021,Sudah Kembali
,Hadis dimata orientalis: telaah atas pandangan Ignaz Goldziher dan Joseph Schacht,Buku Teks,10/1/2021,10/8/2021,Sudah Kembali
,Teori common link G.H.A. Juynboll: melacak akar kesejarahan hadits Nabi,Buku Teks,10/1/2021,10/8/2021,Sudah Kembali
,Muslim Stusies,Buku Teks,10/1/2021,10/8/2021,Sudah Kembali
21191200000057,Metode A'isyah dalam kritik hadis,Disertasi,10/1/2021,10/8/2021,Sudah Kembali
pascasarjana,Aneka pendekatan studi agama,Buku Teks,9/30/2021,10/7/2021,Sudah Kembali
,Warna Islam Indonesia: Ekspresi Umat Islam Di Indonesia,Buku Teks,9/29/2021,10/6/2021,Sudah Kembali
,Kajian Islam kontemporer,Buku Teks,9/29/2021,10/6/2021,Sudah Kembali
,Menejemen pendidikan pada madrasah Aliyah dan peranannya pada pencapaian tujuan pendidikan nasional,Disertasi,9/29/2021,10/6/2021,Sudah Kembali
,Metode penelitian kombinasi: mixed methods,Buku Teks,9/28/2021,10/5/2021,Sudah Kembali
,Aneka pendekatan studi agama,Buku Teks,9/28/2021,10/5/2021,Sudah Kembali
,Jaringan Ulama,Buku Teks,9/27/2021,10/4/2021,Sudah Kembali
pascasarjana,Pengantar antropologi,Buku Teks,9/27/2021,10/4/2021,Sudah Kembali
,Metodologi Ilmu Tafsir,Buku Teks,9/27/2021,10/4/2021,Sudah Kembali
,Ilmu Hadis,Buku Teks,9/27/2021,10/4/2021,Sudah Kembali
,Dasar-dasar Ilmu Hadis,Buku Teks,9/27/2021,10/4/2021,Sudah Kembali
,Ilmu Hadits Praktis,Buku Teks,9/27/2021,10/4/2021,Sudah Kembali
,Pembaharuan Pemikiran Modern Dalam Islam,Buku Teks,9/27/2021,10/4/2021,Sudah Kembali
,Pembaharuan dalam Islam: sejarah pemikiran dan gerakan,Buku Teks,9/27/2021,10/4/2021,Sudah Kembali
,Chiefdom Madinah : salah paham negara Islam,Buku Teks,9/24/2021,10/1/2021,Sudah Kembali
,Piagam Madinah dan Undang-Undang Daar 1945 : Kajian Perbandingan Tentang Dasar Hidup bersama Dalam Masyarakat Yang Majemuk,Buku Teks,9/24/2021,10/1/2021,Sudah Kembali
,Sejarah politik islam,Buku Teks,9/24/2021,10/1/2021,Sudah Kembali
,Life of Muhammad (the),Buku Teks,9/24/2021,10/1/2021,Sudah Kembali
pascasarjana,"Historiografi Islam kontemporer: wacana, aktualitas, dan aktor sejarah",Buku Teks,9/24/2021,10/1/2021,Sudah Kembali
pascasarjana,Oral and the written in early Islam,Buku Teks,9/24/2021,10/1/2021,Sudah Kembali
pascasarjana,Islamic Historiography,Buku Teks,9/24/2021,10/1/2021,Sudah Kembali
,Konsep dan teknik penelitian Gender,Buku Teks,9/24/2021,10/1/2021,Sudah Kembali
21191200000057,Formalisasi akad fikih dalam transaksi modern : kajian atas konsepsi aqad fiqih pada sistem perbankan syari'ah di Indonesia,Disertasi,9/24/2021,10/1/2021,Sudah Kembali
,Pendidikan rohani dalam perspektif Ibn Qayyim al-Jawziyah,Tesis,9/24/2021,9/24/2021,Belum Kembali
,Hubungan ilmu dengan amal menurut al-ghazali,Tesis,9/24/2021,10/1/2021,Belum Kembali
,"Pendidikan kewargaan : demokrasi, HAM dan masyarakat madani",Buku Teks,9/24/2021,10/8/2021,Sudah Kembali
,"Pengembangan kurikulum Pendidikan Agama Islam : di sekolah, madrasah, dan perguruan tinggi",Buku Teks,9/24/2021,10/8/2021,Sudah Kembali
,"Arah baru pengembangan pendidikan islam; pemberdayaan, pengembangan kurikulum, hingga redifinisi islamisasi pengetahuan",Buku Teks,9/24/2021,10/8/2021,Sudah Kembali
,Pengembangan Kurikulum: Teori Dan Praktik,Buku Teks,9/24/2021,10/8/2021,Sudah Kembali
,Pembelajaran dalam implementasi kurikulum berbasis kompetensi,Buku Teks,9/24/2021,10/8/2021,Sudah Kembali
,Pembelajaran dalam implementasi kurikulum berbasis kompetensi,Buku Teks,9/24/2021,10/8/2021,Sudah Kembali
,Kurikulum dan pembelajaran: teori dan praktik pengembangan kurikulum KTSP,Buku Teks,9/24/2021,10/8/2021,Sudah Kembali
pascasarjana,Aneka pendekatan studi agama,Buku Teks,9/23/2021,9/30/2021,Sudah Kembali
pascasarjana,Agama Suatu Teori Sekuler,Buku Teks,9/23/2021,9/30/2021,Sudah Kembali
,Islamku Islam anda Islam kita: agama masyarakat negara demokrasi,Buku Teks,9/21/2021,9/28/2021,Sudah Kembali
,Islam Kebangsaan: Fiqih Demokratik Kaum Santri,Buku Teks,9/21/2021,9/28/2021,Sudah Kembali
,islam sistem nilai terpadu,Buku Teks,9/21/2021,9/28/2021,Sudah Kembali
,Aneka pendekatan studi agama,Buku Teks,9/21/2021,9/28/2021,Sudah Kembali
,Merayakan Kebebasan Beragama: Bunga Rampai 70 Tahun Djohan Effendi,Buku Teks,9/21/2021,9/28/2021,Sudah Kembali
,"Agama dan konflik Sosial : Studi kerukunan umat beragama, radikalisme, dan konflik antarumat beragama",Buku Teks,9/21/2021,9/28/2021,Sudah Kembali
,Religion And Public Policy,Buku Teks,9/21/2021,9/28/2021,Sudah Kembali
pascasarjana,Memberdayakan Sistem Pendidikan Islam,Buku Teks,9/21/2021,9/28/2021,Sudah Kembali
pascasarjana,Tradisi pesantren: studi tenatang pandangan hidup Kyai,Buku Teks,9/21/2021,9/28/2021,Sudah Kembali
,"""Character Matters : Personal Karakter (Bagaimana membantu anak mengembangkan penilaian yang baik, integritas, dan keabjikan penting lainnya)""",Buku Teks,9/20/2021,9/27/2021,Sudah Kembali
,Beberapa perspektif : Sosiologi pendidikan,Buku Teks,9/20/2021,9/27/2021,Sudah Kembali
,Secularism and its Critics,Buku Teks,9/20/2021,9/27/2021,Sudah Kembali
,Negara sekuler sebuah polemik,Buku Teks,9/20/2021,9/27/2021,Sudah Kembali
,"Secularism and state policies toward religion : the United States, France, and Turkey",Buku Teks,9/20/2021,9/27/2021,Sudah Kembali
,Pemikiran 'Abdullahi Ahmed an-Na'im tentang relasi Islam dan Negara,Disertasi,9/20/2021,9/27/2021,Sudah Kembali
,Islam dan negara : transfoemasi pemikiran dan praktik politik Islam di Indonesia,Buku Teks,9/20/2021,9/27/2021,Sudah Kembali
,Islam liberalisme demokrasi : membangun sinerji warisan sejarah doktrin dan konteks global,Buku Teks,9/20/2021,9/27/2021,Sudah Kembali
,Revolusi Tak Kunjung Selesai: Potret Indonesia Masa Kini,Buku Teks,9/20/2021,9/27/2021,Sudah Kembali
,Good governance: a workable solution for Indonesia?,Buku Teks,9/20/2021,9/27/2021,Sudah Kembali
,Indonesia in transition : social aspects reformasi and crisis,Buku Teks,9/20/2021,9/27/2021,Sudah Kembali
pascasarjana,Komunikasi Politik : khalayak dan efek,Buku Teks,9/20/2021,9/27/2021,Sudah Kembali
pascasarjana,Pengantar antropologi,Buku Teks,9/20/2021,9/27/2021,Sudah Kembali
pascasarjana,Arkeologi islam nusantara,Buku Teks,9/20/2021,9/27/2021,Sudah Kembali
pascasarjana,Contemporary issues in the Islamic world: indonesia perspective,Buku Teks,9/20/2021,9/27/2021,Sudah Kembali
,Konsep syifa' dalam al-Qur'an : pendekatan tafsir tematik,Disertasi,9/17/2021,9/24/2021,Sudah Kembali
,Toleransi Beragama Berbasis Budaya Lokal,Disertasi,9/17/2021,9/24/2021,Sudah Kembali
,Insan ilahiah,Buku Teks,9/17/2021,9/24/2021,Sudah Kembali
,Warisan sufi; warisan sufisme Persia abad pertengahan (1150-1500),Buku Teks,9/17/2021,9/24/2021,Sudah Kembali
,Warisan sufi; warisan sufisme Persia abad pertengahan (1150-1500),Buku Teks,9/17/2021,9/24/2021,Sudah Kembali
,Violence in Islamic Thought,Buku Teks,9/17/2021,9/24/2021,Sudah Kembali
,Terrorism and violence in Southeast Asia: trans,Buku Teks,9/17/2021,9/24/2021,Sudah Kembali
,Konsep dan teknik penelitian Gender,Buku Teks,9/17/2021,9/24/2021,Sudah Kembali
,Asaaliib al-ma'anii fii tafsiir zahrah al-tafaasir : diraasah balaaghiyyah tahliliyyah,Disertasi,9/16/2021,9/23/2021,Sudah Kembali
,Sirah Nabi : Buku Sejarah Muhammad SAW,Buku Teks,9/15/2021,9/22/2021,Sudah Kembali
,Women and gender in Islam,Buku Teks,9/15/2021,9/22/2021,Sudah Kembali
,Hadis dan Orientalis: perspektif ulama dan para orientalis tentang hadis Nabi,Buku Teks,9/15/2021,9/22/2021,Sudah Kembali
,Hadis dimata orientalis: telaah atas pandangan Ignaz Goldziher dan Joseph Schacht,Buku Teks,9/15/2021,9/22/2021,Sudah Kembali
,Life of Muhammad (the),Buku Teks,9/15/2021,9/22/2021,Sudah Kembali
,Teori common link G.H.A. Juynboll: melacak akar kesejarahan hadits Nabi,Buku Teks,9/15/2021,9/22/2021,Sudah Kembali
,Fikih Kawin Anak: Membaca Ulang Teks Keagamaan Perkawinan Usia Anak-Anak,Buku Teks,9/15/2021,9/22/2021,Sudah Kembali
,Sastra dan Ilmu Sastra,Buku Teks,9/15/2021,9/22/2021,Sudah Kembali
pascasarjana,Arkeologi islam nusantara,Buku Teks,9/14/2021,9/21/2021,Sudah Kembali
pascasarjana,Dinamika Kontemporer dalam Masyarakat Islam,Buku Teks,9/14/2021,9/21/2021,Sudah Kembali
pascasarjana,Contemporary issues in the Islamic world: indonesia perspective,Buku Teks,9/14/2021,9/21/2021,Sudah Kembali
