Username,Judul,Tipe Koleksi,Tanggal Dipinjam,Harus Kembali,Status Pengembalian
,Renaisans Islam : kebangkitan intelektual dan budaya pada abad pertengahan :,Buku Teks,4/5/2021,4/12/2021,Sudah Kembali
,Sejarah Islam klasik: perkembangan ilmu pengetahuan Islam,Buku Teks,4/5/2021,4/12/2021,Sudah Kembali
,Sejarah peradaban Islam,Buku Teks,4/5/2021,4/12/2021,Sudah Kembali
,Sejarah Sosial Umat Islam,Buku Teks,4/5/2021,4/12/2021,Sudah Kembali
,Transformasi sosial dan perceraian: studi kasus relasi keluarga Muslim di Kota Bogor,Tesis,4/5/2021,4/12/2021,Sudah Kembali
,Simbolisme Islam di Ranah Publik: tinjauan Antropologi Hukum Islam Hijab Paramedis di Rumah Sakit,Tesis,4/5/2021,4/12/2021,Sudah Kembali
,Teror atas nama Tuhan,Buku Teks,4/5/2021,4/12/2021,Sudah Kembali
pascasarjana,Dari Jihad Menuju Ijtihad,Buku Teks,4/5/2021,4/12/2021,Sudah Kembali
pascasarjana,Partai Keadilan Sejahtera : wajah baru Islam politik Indonesia,Buku Teks,4/5/2021,4/12/2021,Sudah Kembali
,Format-format penelitian sosial,Buku Teks,4/5/2021,4/12/2021,Sudah Kembali
,Qualitative Research: A Guide to Design and Implementation,Buku Teks,4/5/2021,4/12/2021,Sudah Kembali
,Metodologi Studi Islam,Buku Teks,4/5/2021,4/12/2021,Sudah Kembali
,Approaches to Islam in religious studies,Buku Teks,4/5/2021,4/12/2021,Sudah Kembali
,Jaringan Ulama,Buku Teks,4/5/2021,4/12/2021,Sudah Kembali
,Metode Penelitian Hukum,Buku Teks,4/5/2021,4/12/2021,Sudah Kembali
,Hak Hadanah Pada Ayah: Analisis Yurisprudensi Mahkamah Agung,Tesis,4/1/2021,4/8/2021,Sudah Kembali
,"Hak Asasi Manusia: hakekat, konsep dan implikasinya dalam perspektif hukum dan masyarakat",Buku Teks,4/1/2021,4/8/2021,Sudah Kembali
,Fiqh Munakahat,Buku Teks,4/1/2021,4/8/2021,Sudah Kembali
,Fiqh perbandingan masalah pernikahan,Buku Teks,4/1/2021,4/8/2021,Sudah Kembali
,Islam menggugat poligami,Buku Teks,4/1/2021,4/8/2021,Sudah Kembali
,Kontroversi revisi kompilasi hukum Islam,Buku Teks,4/1/2021,4/8/2021,Sudah Kembali
31191200000042,"Teori Sosial Kritis : Kritik, Penerapan dan Implikasinya",Buku Teks,4/1/2021,4/8/2021,Sudah Kembali
,Diskursus Pribumisasi Islam dalam dakwah kultural Abdurrahman Wahid : perspektif tindakan kominikatif Jurgen Habermas,Disertasi,4/1/2021,4/8/2021,Sudah Kembali
,Dinamika politik NU era Presiden Gus Dur,Disertasi,4/1/2021,4/8/2021,Sudah Kembali
,Ayat-Ayat Kelautan Dalam Tafsir al-Misbah,Disertasi,4/1/2021,4/8/2021,Sudah Kembali
,"Memahami Tafsir Sufi Sejarah, Sumber dan Metode (Studi Terhadap Tafsir al-Sulami dan al-Qushayri)",Disertasi,4/1/2021,4/8/2021,Sudah Kembali
,Orientalis dan diabolisme pemikiran,Buku Teks,4/1/2021,4/8/2021,Sudah Kembali
,Islam dan Sekularisme,Buku Teks,4/1/2021,4/8/2021,Sudah Kembali
pascasarjana,Manajemen Pendidikan,Buku Teks,5/31/2021,6/7/2021,Sudah Kembali
pascasarjana,Kekuasaan dan Pendidikan: Manajemen Pendidikan Nasional Dalam Pusaran Kekuasaan,Buku Teks,5/31/2021,6/7/2021,Sudah Kembali
pascasarjana,Manajemen Madrasah Satu Atap,Buku Teks,5/31/2021,6/7/2021,Sudah Kembali
pascasarjana,Manajemen Mutu Kepemimpinan Pendidikan,Buku Teks,5/31/2021,6/7/2021,Sudah Kembali
,The Cambridge History of Renaissance Philosophy,Buku Teks,5/31/2021,6/7/2021,Sudah Kembali
,Central Readings in the History of Modern Philosophy: descartes to kant,Buku Teks,5/31/2021,6/7/2021,Sudah Kembali
,Spiritual growth and care in fourth age of life,Buku Teks,5/31/2021,6/7/2021,Sudah Kembali
,Hak Hadanah Pada Ayah: Analisis Yurisprudensi Mahkamah Agung,Tesis,5/31/2021,6/7/2021,Sudah Kembali
,Keadilan hukum Dalam Berbagai aspek hukum Nasional,Buku Teks,5/31/2021,6/7/2021,Sudah Kembali
,Praktik Peradilan Perdata dan Alternatif Penyelesaian Sengketa,Buku Teks,5/31/2021,6/7/2021,Sudah Kembali
,Hukum pembuktian di peradilan agama,Buku Teks,5/31/2021,6/7/2021,Sudah Kembali
,Pengantar penelitian hukum,Buku Teks,5/31/2021,6/7/2021,Sudah Kembali
,Radical Islam: medieval theology and modern politics,Buku Teks,5/31/2021,6/7/2021,Sudah Kembali
,Dampak pembubaran masyumi terhadap hubungan politik antara islam dan negara,Tesis,5/31/2021,6/7/2021,Sudah Kembali
,Pergeseran paradigma politik nahdlatul ulama era reformasi (1998-2000),Tesis,5/31/2021,6/7/2021,Sudah Kembali
,Politics and cultures of Islamization Asia : Indonesia and Malaysia in 1990,Buku Teks,5/31/2021,6/7/2021,Sudah Kembali
,Mengatasi Stres Melalui Spriritualitas dan Regulasi Diri: Studi pada Mahasiswa Kedokteran di DKI Jakarta,Disertasi,5/28/2021,6/4/2021,Sudah Kembali
,Konsep,Disertasi,5/28/2021,6/4/2021,Sudah Kembali
pascasarjana,Toleransi Beragama Berbasis Budaya Lokal,Disertasi,5/28/2021,6/4/2021,Sudah Kembali
pascasarjana,Akulturasi Nilai - Nilai Persaudaraan Islam Model Dayah Aceh,Buku Teks,5/28/2021,6/4/2021,Sudah Kembali
pascasarjana,Manhaj tarjih Muhammadiyah: metodologi dan aplikasi,Buku Teks,5/27/2021,6/3/2021,Sudah Kembali
pascasarjana,Maqashid Syariah,Buku Teks,5/27/2021,6/3/2021,Sudah Kembali
pascasarjana,Ushul Fiqih,Buku Teks,5/27/2021,5/27/2021,Sudah Kembali
pascasarjana,Masailul fiqhiyah : berbagai kasus yang dihadapi hukum Islam masa kini,Buku Teks,5/27/2021,5/27/2021,Sudah Kembali
,Asian Islam in the 21st Century,Buku Teks,5/27/2021,6/3/2021,Sudah Kembali
pascasarjana,Salib di bulan sabit: dialog antariman Islam-Kristen,Buku Teks,5/27/2021,6/3/2021,Sudah Kembali
pascasarjana,Venture of Islam ; iman & sejarah dalam peradaban dunia,Buku Teks,5/27/2021,6/3/2021,Sudah Kembali
pascasarjana,Abrahamic Faiths,Buku Teks,5/27/2021,6/3/2021,Sudah Kembali
pascasarjana,Islam dan orientalisme : sebuah kajian analitik,Buku Teks,5/27/2021,6/3/2021,Sudah Kembali
pascasarjana,the Elementary Form of The Religious Life : sejarah bentuk agama-agama yang paling dasar,Buku Teks,5/27/2021,6/3/2021,Sudah Kembali
pascasarjana,Sosiologi Agama,Buku Teks,5/27/2021,6/3/2021,Sudah Kembali
pascasarjana,Sosiologi Agama,Buku Teks,5/27/2021,6/3/2021,Sudah Kembali
pascasarjana,Pendidikan Toleransi Beragama (Kajian atas Pembelajaran Agama Di Binus School Jakarta),Disertasi,5/27/2021,6/3/2021,Sudah Kembali
,Kebebasan Beragama dan Integrasi Sosial,Buku Teks,5/25/2021,6/8/2021,Sudah Kembali
,Kebebasan beragama atau berkeyakinan ; seberapa jauh?,Buku Teks,5/25/2021,6/8/2021,Sudah Kembali
,Merayakan Kebebasan Beragama: Bunga Rampai 70 Tahun Djohan Effendi,Buku Teks,5/25/2021,6/8/2021,Sudah Kembali
,"Syariah Islam dan HAM: dampak Perda Syariah terhadap kebebasan Sipil, Hak-Hak Perempuan, dan Non-Muslim",Buku Teks,5/25/2021,6/8/2021,Sudah Kembali
,"Philosophy in the middle ages: the Christian, Islamic,and Jewish Traditions",Buku Teks,5/25/2021,6/1/2021,Sudah Kembali
,"Aristotle's Children: how christians, muslims, and jews rediscovered ancient wisdom and illuminated the dark ages",Buku Teks,5/25/2021,6/1/2021,Sudah Kembali
,Filsafat Abad 20,Buku Teks,5/25/2021,6/1/2021,Sudah Kembali
,Sensitivitas gender hakim kasasi dalam pertimbangan hukum Analisis Putusan Kasasi Tahun 2015,Tesis,5/24/2021,5/31/2021,Sudah Kembali
,Pokok-Pokok Hukum Acara Perdata Peradilan Agma Dan Mahkamah Syariah Di Indonesia,Buku Teks,5/24/2021,5/31/2021,Sudah Kembali
,Peradilan Agama dalam Bingkai Reformasi Hukum di Indonesia,Buku Teks,5/24/2021,5/31/2021,Sudah Kembali
,Catatan bijak membela kebenaran menegakkan keadilan,Buku Teks,5/24/2021,5/31/2021,Sudah Kembali
,Teori hukum,Buku Teks,5/24/2021,5/31/2021,Sudah Kembali
,Ilmu Hukum,Buku Teks,5/24/2021,5/31/2021,Sudah Kembali
,Qualitative Research: A Guide to Design and Implementation,Buku Teks,5/24/2021,5/31/2021,Sudah Kembali
,"Metodologi Penelitian Kualitatif: Pendekatan Positivistik, Rsaionalistik, Phenomenologik, dan Realisme Metaphisik Telaah Studi Teks dan Penelitian Agama",Buku Teks,5/24/2021,5/31/2021,Sudah Kembali
,Hubungan ilmu dengan amal menurut al-ghazali,Tesis,5/24/2021,5/31/2021,Sudah Kembali
,Pendidikan rohani dalam perspektif Ibn Qayyim al-Jawziyah,Tesis,5/24/2021,5/24/2021,Sudah Kembali
,"Pengalaman Beragama, Reseliensi Dan Kebahagiaan Dalam Perspektif Psikospiritual (Studi Pada Pengamal Dzikrul Ghofilin)",Disertasi,5/24/2021,5/31/2021,Sudah Kembali
pascasarjana,Bahasa dan kekuasaan dalam sejarah Islam,Disertasi,5/21/2021,5/28/2021,Sudah Kembali
,Arkeologi islam nusantara,Buku Teks,5/20/2021,5/27/2021,Sudah Kembali
,Jejak-jejak jaringan kaum muslim dari Australia hingga Timur Tengah,Buku Teks,5/20/2021,5/27/2021,Sudah Kembali
,Indonesian historigraphy,Buku Teks,5/20/2021,5/27/2021,Sudah Kembali
,Renaisans Islam Asia Tenggara : sejarah wacana dan kekuasaan,Buku Teks,5/20/2021,5/27/2021,Sudah Kembali
,Sejarah Peradaban Islam,Buku Teks,5/20/2021,5/27/2021,Sudah Kembali
pascasarjana,Pengantar metode penelitian: an introduction to research methode,Buku Teks,5/20/2021,5/27/2021,Sudah Kembali
pascasarjana,Metode penelitian sejarah,Buku Teks,5/20/2021,5/27/2021,Sudah Kembali
pascasarjana,Metodologi penelitian sejarah,Buku Teks,5/20/2021,5/27/2021,Sudah Kembali
pascasarjana,K. H Hasan Basri (1920-!998) : kajian biografis tokoh Majelis Ulama Indonesia,Buku Teks,5/20/2021,5/27/2021,Sudah Kembali
pascasarjana,Manajemen Pendidikan,Buku Teks,5/20/2021,5/27/2021,Sudah Kembali
,Metodologi penelitian kuantitatif,Buku Teks,5/19/2021,5/26/2021,Sudah Kembali
,Dasar-Dasar Metodologi Penelitian Kwantitatif Dalam Pendidikan,Buku Teks,5/19/2021,5/26/2021,Sudah Kembali
,Metodologi Penelitian Pendidikan: Kompetensi dan Praktiknya,Buku Teks,5/19/2021,5/26/2021,Sudah Kembali
,Pengantar Metode Statistik jilid 1,Buku Teks,5/19/2021,5/26/2021,Sudah Kembali
,Asian Islam in the 21st Century,Buku Teks,5/19/2021,5/26/2021,Sudah Kembali
pascasarjana,Gender dan strategi pengarus-utamaannya di Indonesia,Buku Teks,5/19/2021,5/26/2021,Sudah Kembali
pascasarjana,Hak-hak perempuan pasca perceraian: analisis pertimbangan Hakim dalam Putusan Pengadilan Agama Padangsidimpuan,Tesis,5/19/2021,5/26/2021,Sudah Kembali
pascasarjana,Gender voices: telaah kritis relasi bahasa-gender,Buku Teks,5/19/2021,5/26/2021,Sudah Kembali
,"Metode penelitian kuantitatif, kualitatif dan R&D",Buku Teks,5/19/2021,5/26/2021,Sudah Kembali
,Metodologi Ilmu Tafsir,Buku Teks,5/19/2021,5/26/2021,Sudah Kembali
,Metodologi Penelitian Pendidikan Kuantitatif & Kualitatif,Buku Teks,5/19/2021,5/26/2021,Sudah Kembali
,Metode penelitian dakwah: dengan pendekatan kualitatif,Buku Teks,5/19/2021,5/26/2021,Sudah Kembali
,Pokok-Pokok Hukum Acara Perdata Peradilan Agma Dan Mahkamah Syariah Di Indonesia,Buku Teks,5/17/2021,5/24/2021,Sudah Kembali
,Peradilan Agama dalam Bingkai Reformasi Hukum di Indonesia,Buku Teks,5/17/2021,5/24/2021,Sudah Kembali
,Catatan bijak membela kebenaran menegakkan keadilan,Buku Teks,5/17/2021,5/24/2021,Sudah Kembali
,Teori hukum,Buku Teks,5/17/2021,5/24/2021,Sudah Kembali
,Ilmu Hukum,Buku Teks,5/17/2021,5/24/2021,Sudah Kembali
,Hak Hadanah Pada Ayah: Analisis Yurisprudensi Mahkamah Agung,Tesis,5/17/2021,5/24/2021,Sudah Kembali
pascasarjana,Manajemen Pendidikan Nasional,Buku Teks,5/17/2021,5/24/2021,Sudah Kembali
pascasarjana,Manajemen pendidikan Indonesia,Buku Teks,5/17/2021,5/24/2021,Sudah Kembali
pascasarjana,Guru Profesional,Buku Teks,5/17/2021,5/24/2021,Sudah Kembali
pascasarjana,Manajemen Madrasah Satu Atap,Buku Teks,5/17/2021,5/24/2021,Sudah Kembali
,Sejarah Islam,Buku Teks,5/10/2021,5/17/2021,Sudah Kembali
,Gagalnya islam politik,Buku Teks,5/10/2021,5/17/2021,Sudah Kembali
,Reformulasi pendidikan islam,Buku Teks,5/10/2021,5/17/2021,Sudah Kembali
,Mengislamkan tanah jawa: telaah atas metode dakwah Walisongo,Buku Teks,5/10/2021,5/17/2021,Sudah Kembali
pascasarjana,Gender dan strategi pengarus-utamaannya di Indonesia,Buku Teks,5/10/2021,5/17/2021,Sudah Kembali
pascasarjana,Hak-hak perempuan pasca perceraian: analisis pertimbangan Hakim dalam Putusan Pengadilan Agama Padangsidimpuan,Tesis,5/10/2021,5/17/2021,Sudah Kembali
pascasarjana,Gender voices: telaah kritis relasi bahasa-gender,Buku Teks,5/10/2021,5/17/2021,Sudah Kembali
,Hak Hadanah Pada Ayah: Analisis Yurisprudensi Mahkamah Agung,Tesis,5/7/2021,5/14/2021,Sudah Kembali
,Fiqh al-Islam wa adilatuhu,Buku Teks,5/7/2021,5/14/2021,Sudah Kembali
,Fiqh Munakahat,Buku Teks,5/7/2021,5/14/2021,Sudah Kembali
,Peradilan Islam dalam tatanan masyarakat Indonesia,Buku Teks,5/7/2021,5/14/2021,Sudah Kembali
,"Perlembagaan Hukum Islam Di Indonesia: akar sejarah, hambatan dan prospeknya",Buku Teks,5/7/2021,5/14/2021,Sudah Kembali
,Hukum Keluarga Di Dunia Islam Modern: Studi Perbandingan dan Kebijakan UU Modern dari Kitab-kitab Fikih,Buku Teks,5/7/2021,5/14/2021,Sudah Kembali
pascasarjana,The family structure in Islam,Buku Teks,5/7/2021,5/14/2021,Sudah Kembali
,Investasi Syariah: implementasi konsep pada kenyataan empirik,Buku Teks,5/7/2021,5/14/2021,Sudah Kembali
,Pedoman Pengelolaan Wakaf Tunai,Buku Teks,5/7/2021,5/14/2021,Sudah Kembali
,Wakaf produktif,Buku Teks,5/7/2021,5/14/2021,Sudah Kembali
,"Pengalaman Beragama, Reseliensi Dan Kebahagiaan Dalam Perspektif Psikospiritual (Studi Pada Pengamal Dzikrul Ghofilin)",Disertasi,5/7/2021,5/14/2021,Sudah Kembali
,Panduan meraih kebahagiaan menurut Al-Qur'an,Buku Teks,5/7/2021,5/14/2021,Sudah Kembali
,Pendidikan rohani dalam perspektif Ibn Qayyim al-Jawziyah,Tesis,5/6/2021,5/13/2021,Sudah Kembali
,Sejarah Politk Islam,Buku Teks,5/6/2021,5/13/2021,Sudah Kembali
,Religion in the Contemporary World,Buku Teks,5/6/2021,5/13/2021,Sudah Kembali
,Masyarakat Al-Ikhwan Al-Muslimin,Buku Teks,5/6/2021,5/13/2021,Sudah Kembali
,Brief history of Crusades,Buku Teks,5/6/2021,5/13/2021,Sudah Kembali
,Dinamika Kerukunan Antarumat Beragama,Buku Teks,5/6/2021,5/13/2021,Sudah Kembali
,Metode penelitian,Buku Teks,5/5/2021,5/12/2021,Sudah Kembali
,Metodologi penelitian sejarah,Buku Teks,5/5/2021,5/12/2021,Sudah Kembali
,Metode penelitian sejarah,Buku Teks,5/5/2021,5/12/2021,Sudah Kembali
pascasarjana,Sosiologi Dakwah,Buku Teks,5/5/2021,5/12/2021,Sudah Kembali
pascasarjana,Islam dalam perspektif sosio kultural,Buku Teks,5/5/2021,5/12/2021,Sudah Kembali
pascasarjana,Ulama & Kekuasaan: pergumulam elite muslim dalam sejaran Indonesia,Buku Teks,5/5/2021,5/12/2021,Sudah Kembali
,Membumikan Islam Nusantara,Buku Teks,5/5/2021,5/12/2021,Sudah Kembali
,Islam Nusantara: relasi agama-budaya dan tendensi kuasa Ulama,Buku Teks,5/5/2021,5/12/2021,Sudah Kembali
,Menatap wajah islam Indonesia,Buku Teks,5/5/2021,5/12/2021,Sudah Kembali
,"Ulama, Islam dan Nusantara : catatan ringkas pergulatan pemikiran keagamaan",Buku Teks,5/5/2021,5/12/2021,Sudah Kembali
pascasarjana,Manajemen Pendidikan Nasional,Buku Teks,5/4/2021,5/11/2021,Sudah Kembali
pascasarjana,Manajemen Pendidikan,Buku Teks,5/4/2021,5/11/2021,Sudah Kembali
pascasarjana,Manajemen pendidikan Indonesia,Buku Teks,5/4/2021,5/11/2021,Sudah Kembali
pascasarjana,Guru Profesional,Buku Teks,5/4/2021,5/11/2021,Sudah Kembali
pascasarjana,Manajemen Madrasah Satu Atap,Buku Teks,5/4/2021,5/11/2021,Sudah Kembali
,Konversi ke Islam pada orang Dayak,Disertasi,5/3/2021,5/10/2021,Sudah Kembali
,Ikhwanul Muslimin di Mesir : telaah atas gerakan keagamaan pra rtevolusi di Mesir,Disertasi,5/3/2021,5/10/2021,Sudah Kembali
,Kristenisasi Dunia Tanggapan Terhadap Surat Apostolik Paus Yohanes Paulus II,Buku Teks,5/3/2021,5/10/2021,Sudah Kembali
,The Feminine face of God : the unfolding of the sacred in women,Buku Teks,5/3/2021,5/10/2021,Sudah Kembali
,Semangat Lebih Yesuit,Buku Teks,5/3/2021,5/10/2021,Sudah Kembali
,Anatomi konflik politik di indonesia; belajar dari ketegangan politik varian di madukoro4,Buku Teks,5/3/2021,5/10/2021,Sudah Kembali
,"Epistemologi Inkar Sunnah: studi kritis pemikiran Rashad Khalifa, Edip Yuksel, dan Sam Gerrans",Tesis,5/3/2021,5/10/2021,Sudah Kembali
,"Nalar Islam Nusantara: Studi Islam Ala Muhammadiyah, Al-Irsyad, Persis dan NU",Buku Teks,5/3/2021,5/10/2021,Sudah Kembali
,Islam warna-warni,Buku Teks,5/3/2021,5/10/2021,Sudah Kembali
,Sikap Pengikut Salafi Wahabi Di Indonesia Dalam Masalah Khilafiyah,Disertasi,5/3/2021,5/10/2021,Sudah Kembali
pascasarjana,Yang Mengenal dirinya yang Mengenal Tuhannya,Buku Teks,5/3/2021,5/10/2021,Sudah Kembali
pascasarjana,Sains Islam yang mengagumkan,Buku Teks,5/3/2021,5/10/2021,Sudah Kembali
pascasarjana,Sosiologi Agama,Buku Teks,5/3/2021,5/10/2021,Sudah Kembali
pascasarjana,Pendidikan Toleransi Beragama (Kajian atas Pembelajaran Agama Di Binus School Jakarta),Disertasi,5/3/2021,5/10/2021,Sudah Kembali
pascasarjana,Implementasi budaya toleransi dalam pendidikan agama,Disertasi,5/3/2021,5/10/2021,Sudah Kembali
pascasarjana,"Multicultural Curriculum: New directions for Social Theory, Practice, and Policy",Buku Teks,5/3/2021,5/10/2021,Sudah Kembali
pascasarjana,Living hadith pernikahan: studi antropologi hadis dalam tradisi Islam Sasak Lombok,Disertasi,5/3/2021,5/10/2021,Sudah Kembali
pascasarjana,Maqasid al-shariah al-Islamiyah wa makarimiha,Buku Teks,5/3/2021,5/10/2021,Sudah Kembali
pascasarjana,Maqashid Syariah,Buku Teks,5/3/2021,5/10/2021,Sudah Kembali
pascasarjana,Critical Issues in Qualitative Research Methods,Buku Teks,5/3/2021,5/10/2021,Sudah Kembali
31171200000045,Ilmu dakwah,Buku Teks,6/25/2021,7/2/2021,Sudah Kembali
31171200000045,Memahami Permasalahan Fikih Dakwah,Buku Teks,6/25/2021,7/2/2021,Sudah Kembali
31171200000045,Ilmu Dawah [dakwah],Buku Teks,6/25/2021,7/2/2021,Sudah Kembali
31171200000045,Psikologi Dakwah,Buku Teks,6/25/2021,7/2/2021,Sudah Kembali
31171200000045,Wacana dakwah kontemporer,Buku Teks,6/25/2021,7/2/2021,Sudah Kembali
,Pembaruan hukum perkawinan di Indonesia,Buku Teks,6/25/2021,7/2/2021,Sudah Kembali
,"Hukum waris , hukum keluarga, hukum pembuktian",Buku Teks,6/25/2021,7/2/2021,Sudah Kembali
,Tipologi Fatwa Ulama Jambi; Metode Ijtihad Guru Muhammad 'Ali ibn 'Abd Al-Wahhab Al-Tunkali dalam Kitab Al-Fatawa Al-Tunkaliyah,Disertasi,6/24/2021,7/1/2021,Belum Kembali
,Kajian Semiotik Atas Nahw Al-Qulub Karya Al-Qushayri (w.465/1072),Disertasi,6/24/2021,7/1/2021,Belum Kembali
,Konstruksi Pengetahuan Pengkritik dan Pembela Qira'at Sab'ah: analisis perbandingan Pemikiran Zamakhshari dan Abu Hayyan Tentang Ragam Qira'at Al-Qur'an,Disertasi,6/24/2021,7/1/2021,Sudah Kembali
,Ensiklopedi Tematis filsafat Islam,Buku Referensi,6/24/2021,6/24/2021,Sudah Kembali
,Oposisi penulisan hadis di Masa Islam Awal,Buku Teks,6/24/2021,7/1/2021,Sudah Kembali
,Cerita Azra: biografi cendekiawan muslim Azyumardi Azra,Buku Teks,6/24/2021,7/1/2021,Sudah Kembali
,The history of Hadith : Historiografi Hadits-Hadits Nabi Dari Masa ke Masa,Buku Teks,6/24/2021,7/1/2021,Sudah Kembali
,Sejarah Politk Islam,Buku Teks,6/24/2021,7/1/2021,Sudah Kembali
pascasarjana,Inilah islam : Pemahaman Dasar Konsep-Konsep Islam,Buku Teks,6/24/2021,7/1/2021,Sudah Kembali
pascasarjana,"Islam, Doktrin dan Peradaban: Sebuah Telaah Kritis tentang Masalah Keimanan, Kemanusiaan, dan Kemodernan",Buku Teks,6/24/2021,7/1/2021,Sudah Kembali
pascasarjana,Kajian Islam kontemporer,Buku Teks,6/24/2021,7/1/2021,Sudah Kembali
,Pendidikan Islam dan Perubahan Sosial: Analisis Praksis Pendidikan Islam di Madrasah Aliyah Muallimin Nahdlatul Wathan Pancor Lombok Timur,Tesis,6/24/2021,7/1/2021,Sudah Kembali
,al-Futuhat al-makkiyah (jilid 1 - 9),Buku Teks,6/23/2021,6/30/2021,Sudah Kembali
pascasarjana,Pendidikan Berorientasi Akhlak di Madrasah Pembangunan UIN Jakarta,Tesis,6/23/2021,6/30/2021,Sudah Kembali
pascasarjana,Pendidikan Karakter TNI Dalam Bingkai Modernisasi,Disertasi,6/23/2021,6/30/2021,Sudah Kembali
pascasarjana,Pendidikan Islam Humanis : Kajian Pemikiran A. Malik Fadjar,Disertasi,6/23/2021,6/30/2021,Sudah Kembali
pascasarjana,"Metode penelitian kuantitatif, kualitatif dan R&D",Buku Teks,6/23/2021,6/30/2021,Sudah Kembali
pascasarjana,Membedah Praktek Keterampilan Vokasi di Madrasah,Disertasi,6/23/2021,6/30/2021,Sudah Kembali
pascasarjana,Pendidikan Toleransi Beragama (Kajian atas Pembelajaran Agama Di Binus School Jakarta),Disertasi,6/23/2021,6/30/2021,Sudah Kembali
pascasarjana,Pendidikan Berwawasan Multikulturan Dalam Pengembangan Keberagamaan Integral,Tesis,6/23/2021,6/30/2021,Sudah Kembali
pascasarjana,Pendidikan agama Islam Berwawasan Pluralisme,Tesis,6/23/2021,6/30/2021,Sudah Kembali
21191200000057,"Kepemimpinan dan Manajemn Kiai Dalam Pendidikan Studi Kasus Pada Pesantren Bendakerep, Gedongan dan Buntet Cirebon",Disertasi,6/23/2021,6/30/2021,Sudah Kembali
21191200000057,Metodologi Penelitian Pendidikan Kuantitatif & Kualitatif,Buku Teks,6/23/2021,6/30/2021,Sudah Kembali
21191200000057,Peran Pendidikan Moral Di Keluarga dan Sekolah Terhadap Karakter siswa,Tesis,6/23/2021,6/30/2021,Sudah Kembali
,Argumen maslahah dalam putusan pengadilan,Disertasi,6/22/2021,6/29/2021,Sudah Kembali
,Hukum Acara Perdata Indonesia,Buku Teks,6/22/2021,6/29/2021,Sudah Kembali
,Hukum pembuktian di peradilan agama,Buku Teks,6/22/2021,6/29/2021,Sudah Kembali
,Pokok-pokok hukum acara perdata dan mahkamah syariah di indonesia,Buku Teks,6/22/2021,6/29/2021,Sudah Kembali
,The Media Students Book,Buku Teks,6/22/2021,6/29/2021,Sudah Kembali
,Pengembangan Model Kurikulum Tingkat Satuan Pendidikan (KTSP) Pada Sekolah dan Madrasah,Buku Teks,6/22/2021,6/29/2021,Sudah Kembali
,Model pembelajaran; menciptakan proses belajar mengajar yang kreatif dan efektif,Buku Teks,6/22/2021,6/29/2021,Sudah Kembali
pascasarjana,Pemikiran Moderat dalam Karya Ulama Nusantara,Buku Teks,6/22/2021,7/6/2021,Sudah Kembali
pascasarjana,Pengembang Islam dan Budaya Moderat,Buku Teks,6/22/2021,7/6/2021,Sudah Kembali
pascasarjana,Moderatisme Islam: kumpulan tulisan para penggerak moderasi beragama,Buku Teks,6/22/2021,7/6/2021,Sudah Kembali
pascasarjana,Mereka Memalsukan Kitab-Kitab Karya Ulama Klasik: Episode Kebohongan Publik Sekte Salafi Wahabi,Buku Teks,6/22/2021,7/6/2021,Sudah Kembali
pascasarjana,Islamic Studies di Perguruan Tinggi: pendekatan integratif-interkonektif,Buku Teks,6/21/2021,6/28/2021,Sudah Kembali
pascasarjana,the Elementary Form of The Religious Life : sejarah bentuk agama-agama yang paling dasar,Buku Teks,6/21/2021,6/28/2021,Sudah Kembali
pascasarjana,Pengantar Epistimologi Islam,Buku Teks,6/21/2021,6/28/2021,Sudah Kembali
pascasarjana,"Hierarki ilmu; membangun rangka-pikir Islamisasi ilmu manurut al-Farabi, al-Ghazali Quthb aI-Din al-Svirazi",Buku Teks,6/21/2021,6/28/2021,Sudah Kembali
pascasarjana,Panorama Filsafat Islam Menembus Batas Waktu,Buku Teks,6/21/2021,6/28/2021,Sudah Kembali
pascasarjana,Sosiologi Agama,Buku Teks,6/21/2021,6/28/2021,Sudah Kembali
pascasarjana,Semantik Bahasa Arab,Buku Teks,6/21/2021,6/28/2021,Belum Kembali
pascasarjana,Kesusastraan Arab: pengantar . . .,Buku Teks,6/21/2021,6/28/2021,Belum Kembali
pascasarjana,Kajian Semantik Arab Klasik dan Kontemporer,Buku Teks,6/21/2021,6/28/2021,Belum Kembali
pascasarjana,Membaca Sastra Dengan Ancangan Literasi Kritis,Buku Teks,6/21/2021,6/28/2021,Belum Kembali
,Ilmu Hadis,Buku Teks,6/21/2021,6/28/2021,Sudah Kembali
,Masterpiece Islam Nusantara: Sanad dan Jejaring Ulama-Santri 91830-1945},Buku Teks,6/21/2021,6/28/2021,Sudah Kembali
,Jejak-jejak Islam politik: sinopsis sejumlah studi Islam Indonesia,Buku Teks,6/21/2021,6/28/2021,Sudah Kembali
,Pendidikan Islam dan Perubahan Sosial: Analisis Praksis Pendidikan Islam di Madrasah Aliyah Muallimin Nahdlatul Wathan Pancor Lombok Timur,Tesis,6/18/2021,6/25/2021,Sudah Kembali
pascasarjana,"Agama, komunikasi politik dan elektabilitas",Disertasi,6/18/2021,6/25/2021,Sudah Kembali
,Peradilan Agama dalam Bingkai Reformasi Hukum di Indonesia,Buku Teks,6/18/2021,6/25/2021,Sudah Kembali
,Pembaruan hukum perkawinan di Indonesia,Buku Teks,6/18/2021,6/25/2021,Sudah Kembali
,Membongkar Cadar Hukum Perjanjian Perkawinan Di Indonesia,Buku Teks,6/18/2021,6/25/2021,Sudah Kembali
,"Hukum waris , hukum keluarga, hukum pembuktian",Buku Teks,6/18/2021,6/25/2021,Sudah Kembali
21191200000057,Perempuan periwayat hadis: studi kitab Arba'in Abu Al-Faid Muhammad Yasin Bin Isa Al-Fadani Al-Makki,Tesis,6/18/2021,6/25/2021,Sudah Kembali
21191200000057,Interaksi Sosial Dalam Periwayatan Hadis (studi hadis-hadis isra'iliyat Abu Hurairah),Tesis,6/18/2021,6/25/2021,Sudah Kembali
,al-Adab al-Mardiyah li-salik tariq al-sufiyah,Buku Teks,6/17/2021,6/24/2021,Sudah Kembali
,Jaringan dan Pembaharuan Ulama Tafsir Nusantara Abad XVI-XXI,Buku Teks,6/17/2021,6/24/2021,Sudah Kembali
,Wujudiyah di Nusantara : Kontinuitas dan Perubahan,Buku Teks,6/17/2021,6/24/2021,Sudah Kembali
,Islam Nusantara: relasi agama-budaya dan tendensi kuasa Ulama,Buku Teks,6/17/2021,6/24/2021,Sudah Kembali
pascasarjana,Pembelajaran Bahasa Arab Dengan Pendekatan CTL Dalam Meningkatkan Kreativitas & Maharat Al-Kalam (Study PTK Di MA Pembangunan UIN Jakarta),Tesis,6/17/2021,6/24/2021,Sudah Kembali
pascasarjana,Pendidikan progresif John Dewey: tinjauan di MAN Insan Cendekia Serpong Tangerang Selatan,Disertasi,6/17/2021,6/24/2021,Sudah Kembali
31191200000042,Tafsir Sosiologis Penghapusan Tujuh Kata Piagam Jakarta: studi atas dokumen Badan Penyelidik Usaha-Usaha Persiapan Kemerdekaan,Tesis,6/17/2021,6/24/2021,Sudah Kembali
31191200000042,Pendidikan berwawasan multikultural sebagai upaya kontra radikalisme,Tesis,6/17/2021,6/24/2021,Sudah Kembali
pascasarjana,Politik dan gender dalam islam: kiprah anggota perempuan DPRD DKI jakarta periode 2009-2019,Disertasi,6/17/2021,6/24/2021,Belum Kembali
31191200000026,"The architectural representation of Islam: Muslim commisioned, mosque design in the Netherland",Buku Teks,6/17/2021,6/24/2021,Belum Kembali
pascasarjana,Sanksi Hukuman Kebiri: Menurut Undang-Undang No. 17 Tahun 2016 Dalam Perspektif Hukum Islam,Tesis,6/17/2021,6/24/2021,Sudah Kembali
pascasarjana,Asas - asas hukum pidana,Buku Teks,6/17/2021,6/24/2021,Sudah Kembali
pascasarjana,Hukum Acara Pidana Indonesia,Buku Teks,6/17/2021,6/24/2021,Sudah Kembali
pascasarjana,Masalah penegakan hukum dan kebijakan hukum pidana dalam penaggulangan kejahatan,Buku Teks,6/17/2021,6/24/2021,Sudah Kembali
pascasarjana,Kajian Islam kontemporer,Buku Teks,6/17/2021,6/24/2021,Sudah Kembali
pascasarjana,Kerukunan Umat Beragama Dalam Al-Qur'an Telaah Penafsiran Kiai Sya'roni Ahmadi,Tesis,6/17/2021,6/24/2021,Sudah Kembali
pascasarjana,Menuju Pemahaman Islam Yang Kaffah,Buku Teks,6/17/2021,6/24/2021,Sudah Kembali
